,author,created_utc,id,num_comments,score,selftext,subreddit,title
868,Gr0ss_Art_,1594324437,hoa0j3,8,21,,AnimalCrossing,I turned my dog into a villager!
869,Swangtheugly,1594307435,ho4rim,6,21,,AnimalCrossing,Ahaha it works and I’m happy.
870,AmyMHouse,1594314521,ho6ws7,1,21,,AnimalCrossing,Wanted to share my new shirt! ...shirt!
871,Krisu94,1594327660,hob07x,9,20,,AnimalCrossing,👀👀👀👀 I mean it’s so obvious...
872,JennaK529,1594314272,ho6tx2,3,20,,AnimalCrossing,I made a cute little Isabelle figure out of polymer clay! I hope you guys like it.
873,ashleeping,1594319134,ho8cod,4,20,,AnimalCrossing,please have cabbage molly
874,stay-stitchy,1594322406,ho9dzs,1,20,,AnimalCrossing,I just really love Pascal so I drew him in procreate!
875,annehamm,1594330840,hobzc6,103,20,,AnimalCrossing,Do you hear it? Everytime...
876,Gel-Lord69,1594329241,hobh6k,348,20,,AnimalCrossing,JUST REALISED FLICK WEARS TINY DOC MARTENS !!
877,geeuh86,1594313615,ho6mm6,0,20,,AnimalCrossing,Welcome to Rivendell! My new island entrance featuring my ginger Gandalf :)
878,MeowgieCat,1594309211,ho5ae5,5,20,,AnimalCrossing,a taiwanese 7-eleven 💕
879,yoshigronk,1594304224,ho3u7a,9,20,,AnimalCrossing,"Why you do this to me, Nintendo?"
880,Captain_Clarisse,1594304746,ho3znp,5,20,,AnimalCrossing,Who bullied you??? &gt;:0
881,IdRatherBeAtTheBeach,1594310140,ho5k4y,1,20,,AnimalCrossing,Here he comes
882,Random-ACNH-Islander,1594320974,ho8xti,0,20,,AnimalCrossing,Maple has been on my island for the longest and I finally got her photo😭
883,jjcctt,1594319586,ho8hx1,34,20,,AnimalCrossing,"I picked up Merengue from another player a few months ago, and figured she was ungifted as I never saw her wear anything different for weeks, until....."
884,Aisance,1594304057,ho3skp,0,19,,AnimalCrossing,an excursion in the woods
885,matcha_sriracha,1594310293,ho5lrt,15,19,,AnimalCrossing,What’s our band name?
886,lovelysanni,1594323359,ho9oi7,6,19,,AnimalCrossing,sooo this happened
887,edgyoilyhuman,1594321734,ho96lo,29,19,,AnimalCrossing,hope this haven’t been done before
888,__Aeraina,1594312015,ho64og,8,19,,AnimalCrossing,Celeste with her stars!
889,MPitcher727,1594318346,ho83nr,4,19,,AnimalCrossing,I made a pub! VERY heavily inspired by the tavern that u/underboobdisco shared on here a while ago
890,MilkyWayGal,1594312784,ho6dda,1,19,,AnimalCrossing,Me when I find out CJ dosent buy marine creatures
891,HolUp23,1594312430,ho69cx,1,18,,AnimalCrossing,"I don't know why I find this video of my villagers changing into raincoats so cute, but I do🥺"
892,msaidyl,1594320599,ho8tl6,8,18,,AnimalCrossing,Me every time I go swimming... 🤦🏾‍♀️
893,printhessa,1594313510,ho6lgv,3,18,,AnimalCrossing,Pocahontas 🧡💚
894,Jaggerous,1594303309,ho3kzy,99,18,,AnimalCrossing,I crocheted Pascal
895,lifeonmars98,1594315606,ho78vr,22,18,,AnimalCrossing,Today got my Nintendo Switch Lite &amp; Animal Crossing New Horizons. Today my adventure starts!
896,alexskyeb,1594319499,ho8gx7,33,18,,AnimalCrossing,Y’all... I gave Skye a blue retro dress today and she looks SO cute. Living her best life 😭💙
897,therealdirtdusty,1594309541,ho5dvb,0,18,,AnimalCrossing,Kiki actually sat in her chair the first day I made her yard!
898,rainyspice,1594315668,ho79kl,4,18,,AnimalCrossing,blushing roscoe embroidery for a friend!
899,NiKHerbs,1594307849,ho4vz4,4,18,,AnimalCrossing,Back then when Dobie proudly opened his farmer's market on my island. Not even rain could stop my old hard working friend!
900,black0utcity,1594355693,hoijxq,0,4,,AnimalCrossing,Pascal keychain!
901,Sweet_sweet_victory,1594352030,hohpmw,188,4,,AnimalCrossing,"Me keeping my vampire squid in my house as a pet/decoration even though it’s worth 8,000 bells"
902,iheartkiwi,1594355979,hoimaf,6,4,,AnimalCrossing,Good thing the mermaid sofa is waterproof 😏
903,Library-tech,1594401634,hot06s,3,4,,AnimalCrossing,I can't get over how GORGEOUS the graphics in this game are
904,Krabby-Daddy,1594405704,houa2i,4,4,,AnimalCrossing,"Got my first villager photo today!! I used to think Harry was a grouch, but now he’s our island dad!"
905,OlafromTreasure,1594403785,hotnvq,6,4,,AnimalCrossing,The Mermaid Cove at Treasure Island during sunrise and sunset - my 2 fave time of the day in the game. Beautiful colored skies 😍 Hope you all like it as much as I do 💙💜
906,enderpower64,1594413773,howsg6,7,3,,AnimalCrossing,I give you front facing gulliver from far away. Pretty cursed if you ask me.
907,sodamoon,1594386264,hookrr,1,3,,AnimalCrossing,one of my favourite photo of erik
908,useless-ppwenwen,1594342501,hofauq,2,3,,AnimalCrossing,Sorry had to take out the watermark from the app
909,spicy_pea,1594366026,hokmgj,2,3,,AnimalCrossing,Love getting the kids dressed up for winter outings
910,Pixelhop,1594408072,hov1kr,0,3,,AnimalCrossing,Animal Crossing mini-platformer✨
911,fireworks-in-july,1594408690,hov8jj,5,3,,AnimalCrossing,My husband's attempt at hiding the flower he accidentally picked from the border around Resident Services
912,Zilverrr,1594401060,hostu0,100,3,,AnimalCrossing,When you finish it’s like coming out of the theatre and it’s suddenly dark outside
913,deciim,1594349599,hoh4qw,6,3,,AnimalCrossing,Excuse my bad editing. But I finally remembered who Tommy &amp; Timmy reminded me of.
914,ImmaBadW0lf,1594342058,hof6nc,28,3,,AnimalCrossing,"We style hair, nails, and mermaid tails! Mermaid salon &lt;3"
915,TheCleverMonkey,1594412616,howg0u,0,3,,AnimalCrossing,I sure hope Blathers doesn't want one of these horrors...
916,ilecaoilfhionn,1594345203,hog07p,0,3,,AnimalCrossing,also me right now
917,m3x1can_memes,1594342665,hofcer,2,3,,AnimalCrossing,not mine but still
918,chelillust,1594402231,hot6oq,2,3,,AnimalCrossing,A reading nook on the river
919,ey_bee_comics,1594422530,hozbf4,0,3,,AnimalCrossing,I “sea” your Point 😫
920,leah_ohdamn,1594411972,how93i,352,3,,AnimalCrossing,My human design for Agnes! This queen doesn’t get enough love!
921,epinards,1594405263,hou4q6,24,3,,AnimalCrossing,I finally caught enough isopods to recreate this meme. It would look even better if Flick made sea creature models!
922,davidbowles97,1594343349,hofixd,0,3,,AnimalCrossing,Gets me every time! 🍃
923,audiophxle,1594344751,hofw1c,9,3,,AnimalCrossing,"A neat detail: if two of your villagers share a birthday, they’ll have a joint birthday celebration :)"
924,eppydeservedbetter,1594408742,hov95b,0,3,,AnimalCrossing,"Finally, my island has a 5 star rating! Here is my friend and I looking cute to celebrate."
925,RubyAndTheRuby,1594341790,hof44k,4,3,,AnimalCrossing,He knows way too much...
926,lmaryjanel,1594360528,hojkhb,1,3,,AnimalCrossing,"Wasn’t the biggest fan of Maple but when she showed up in my campsite, i fell in love with her instantly &lt;33"
927,sxrxhmanning,1594391229,hopvgm,0,3,,AnimalCrossing,Double rainbow today!
928,sebas_2468,1594396487,horfmj,0,3,,AnimalCrossing,"Since I'm now satisfied with all the villagers in my island, I thought it would be a good idea to take a photo of all of us."
929,The-GoblinKing,1594407480,houutu,4,3,,AnimalCrossing,"Welcome to our little island cinema. Todays screening is ""Raiders of the Lost Bark"" starring K.K. Slider."
930,alec0liver,1594419264,hoyesp,2,3,,AnimalCrossing,Daughter gave me a sweet rodney tat.
931,Ladyjane82,1594416796,hoxovp,1,3,,AnimalCrossing,Took Tom Nook and Co. out for Mexican food 😂
932,Natttiee,1594383286,honv89,8,3,,AnimalCrossing,My beach resort is coming along! 🥶 closed for maintenance during the winter
933,bunnietea,1594362237,hojwip,7,3,,AnimalCrossing,Tonight was a good night
934,alexskyeb,1594411228,how13i,6,3,,AnimalCrossing,We had a lil too much fun at the bar last night...
935,chimmFTW,1594403258,hoti4r,275,3,,AnimalCrossing,A guest left this masterpiece on my bulletin board
936,kitty27,1594371899,holnx9,6,3,"Hello everyone!
I wanted to see if there was any sort of pattern or reasons why some villagers are harder to find than others so I collected data from 2024 mystery island tours to see what villagers were the most common and which were the hardest to find. I wrote a short article on what I found if anyone wants to check it out:
https://medium.com/@scrambles277/the-secret-behind-villager-hunting-on-mystery-islands-56850d6191fb?sk=25c73d58de765cbf907829067102b94d
Let me know what you think! Thanks!",AnimalCrossing,An article I wrote on your odds of finding certain villagers on mystery island tours
937,tominey_13,1594409303,hovfmm,4,3,,AnimalCrossing,Unholy and cursed content.
938,AngryOldSod,1594419505,hoyh8w,1,3,,AnimalCrossing,Stupid Plinths. Better ideas to hide?
939,h-evan,1594345546,hog3ek,1,3,,AnimalCrossing,i gave klaus a royal shirt and it’s.. perfect..
940,petitesparkle,1594412014,how9ja,11,3,,AnimalCrossing,"I’m a paediatric resident, so I designed myself a paediatrician’s office in Animal Crossing! The doctor is in!"
941,lim0nly,1594399434,hosby8,4,3,,AnimalCrossing,"The entrance to my Forest, Lazy Town Village. (A place in my island where two of my lazy's live)"
942,KbladeAngel,1594417777,hoxz8t,5,2,,AnimalCrossing,New swimwear from The Summer Sunflower Collection! 🌻 (more skin tones when you search my designer code)
943,NarutoooSasukeee,1594417640,hoxxt5,8,2,,AnimalCrossing,Robot vs. Kaiju battle destroys downtown
944,zekrinaze,1594417223,hoxtgo,4,2,,AnimalCrossing,Kody trying to fit in the gang
945,eelectric_boogalooo,1594423663,hozm7i,2,2,,AnimalCrossing,Tex just moved in. He’s spent all day staring into Butch’s windows. Might take a few days for him to learn the social norms...
946,stoopiduglie,1594407302,houst5,6,2,,AnimalCrossing,Jurassic Park III
947,InnerWeb1,1594425075,hozzjl,9,2,,AnimalCrossing,Finished my underground pool in Animal Crossing! Tutorial in comments.
948,Ampharos71,1594405920,houcjm,1,2,"Brawl of the Best! In this event you are going to decide who's the best villager of all of New Horizons!

Vote for your favorite character of this poll! 

The most voted villager of this poll, will advance to the second round 

[Reference](https://ibb.co/cQdwrMh)

[View Poll](https://www.reddit.com/poll/houcjm)",AnimalCrossing,"Brawl of the Best! First round, match N"
949,DisconnectedChild,1594347445,hogl31,9,2,,AnimalCrossing,Think Octavian will get mad?
950,ButtercupSpread,1594366591,hokq7u,10,2,,AnimalCrossing,"""Not all treasure is gold and silver, Mate! ""☠️"
951,erikbogo,1594392807,hoqbby,6,2,,AnimalCrossing,"You can make a squid collectible, but not an octopus one :/"
952,BrassRoses,1594389787,hoph2g,3,2,,AnimalCrossing,I love Pascal so much
953,Datacom88,1594392146,hoq4r4,0,2,,AnimalCrossing,The real animalCrossing
954,SarahMarieOC,1594397510,horqv5,1,2,,AnimalCrossing,You’re bored? I’m dressed like a grape! 🍇
955,jesseeka_k,1594392439,hoq7of,0,2,,AnimalCrossing,Finally completed the first portion of my garden 🌸 still working on purple and blue hybrids for the other portion!
956,Dness2016,1594341406,hof0mx,11,2,I’ve had an issue with my switch and need to get a new one however I don’t want to loose my 350 hours on animal crossing! Is there anyway I can transfer? I’ve heard some rumours that someone’s done a data mine and said it’ll be coming soon but I’m just not sure. Thank you!,AnimalCrossing,Save data transfer?
957,Matcha0327,1594351135,hohi39,8,2,,AnimalCrossing,Klaus' smug character reminds me of some one I know (not to mention the name lol) and that person buys a lot of amazon prime stuff 😂so I made DIY for Klaus because he's a prime member now 🤣
958,dianemarie_,1594357257,hoiw6y,0,2,,AnimalCrossing,Melba sleeping by the pond in front of Resident Services. Just too cute 😍
959,Akifuu,1594347529,hoglum,4,2,"I've noticed that my lazy villagers are staying up past the coded bed time they are given, is this a glitch, a bug or are they just being kinda dumb?  It has me really worried, since when does a lazy villager talk about caffeine and staying up all night?  Is this happening to anyone else?",AnimalCrossing,Weird behavior?
960,Juarez0o0,1594343718,hofmfx,11,2,,AnimalCrossing,Got any ideas what i could do on this rock also its my first thingi today im not sure what its called lol but any ideas that dont envolve paths?
961,nicesh98,1594354396,hoi9g4,0,2,,AnimalCrossing,"Absolutely no one at all: ... Me on a walk the other day: White hyacinths, red cosmos, yellow roses, wood, and iron nuggets"
962,bubblethea,1594355272,hoigkn,0,2,,AnimalCrossing,Filbert is the only one who can make tequila sound wholesome.
963,SeaweedJill,1594356237,hoio8a,2,2,,AnimalCrossing,"My town is currently at 4 stars right now, but I’m almost getting it to a 5 star rating so I can get something special!"
964,Clork-Keint,1594361856,hojtt3,0,2,,AnimalCrossing,I received this angry message at work - my boyfriend has been rallying for Klaus to leave instead
965,QuickCoyote097,1594363742,hok70p,0,2,,AnimalCrossing,UGH HE IS SO CUTE!
966,mathsucks69,1594367253,hokuha,0,2,,AnimalCrossing,wide raymond&gt; wide putin
967,MOOMlNLAND,1594361502,hojrex,2,2,,AnimalCrossing,"Sherb and Stitches kept telling me about the cookie stains on their clothes, so I built them an outdoor laundromat!"
968,Eve_BP,1594365939,hoklvf,0,2,,AnimalCrossing,Im so happy!!! I need to share &lt;3
969,Melacism,1594392636,hoq9jo,41,2,,AnimalCrossing,something unfortunate happened to gulivarrr..
970,Fast_Narwhal,1594412865,howius,9,2,,AnimalCrossing,Just started to play around with custom designs. Not bad for a first go!
971,_Cheese_Nuts_,1594420863,hoyv1r,5,2,,AnimalCrossing,Today was not a good fishing day. Hopefully I have better luck during the Fishing Tourney tomorrow:(
972,penguinluvr127,1594417179,hoxszy,3,2,,AnimalCrossing,my tea room!
973,GreenSaltMedia,1594395514,hor53q,7,2,,AnimalCrossing,Finally found my old save...from 2010. Grizzly was not pleased.
974,some_random_guy13,1594388608,hop5za,6,2,,AnimalCrossing,"Today was a good ACNH day. I found Zucker in a Nookmile Island and also oranges wich i didn't have in my Island. My rarest villagers are now: Zucker, Raymond and Lucky"
975,allthingsalways,1594404025,hotqia,0,2,,AnimalCrossing,I started making little character watercolors!
976,blepboi69420,1594397492,horqof,2,2,,AnimalCrossing,My girlfriend is learning how to embroider and this is the first thing she made for me. 😍😭😭😍
977,Nyatta,1594405449,hou70m,0,2,,AnimalCrossing,Cherry enjoying life at its fullest
978,akatsukixvx,1594387410,hoov5n,8,2,,AnimalCrossing,Aurora Borealis over the small memorial I made for my mum who passed 2 years ago.
979,acnhnat,1594400820,hosr29,2,2,,AnimalCrossing,"made some qt flick stickers, gonna stick em on everything 🤩"
980,eelectric_boogalooo,1594393505,hoqj0n,8,2,,AnimalCrossing,This is how I learned my island had finally reached 5 stars! What a lovely surprise to wake up to!
981,Plasticmermaid,1594397688,horsqh,1,2,,AnimalCrossing,i wish there was fencing like this in the game to put around gardens
982,Pitza-time,1594409016,hovcc1,0,2,,AnimalCrossing,I made a switch t-shirt! There’s also a hoodie version on my creator profile.
983,Texan1978,1594413174,howm31,0,2,,AnimalCrossing,"Chillin w Horace on a Friday afternoon, chatting about the upcoming fish tourney."
984,BowelTheMovement,1594351589,hohlvw,6,2,"IIRC, and I'm probably not, the maximum bridge and ramp count hasn't changed since the past few titles. Yet, here we are on much better hardware that should well support more, and yet the cap is 8 for either.

I can't help but feel it could certainly handle 12 or more of each easily, and that having an additional 4 of each would dramatically improve what layouts players make. 8 just feels far too restrictive.

We know they can update granted they just added the sea creatures element. So, they should be able to increase the limit on these.",AnimalCrossing,Bridge and Ramp limit confuses me...
985,lipsul,1594401662,hot0hn,3,2,,AnimalCrossing,Teddy searching for some honey in my beekeeping area!!
986,ItsACNH,1594424384,hozsys,6,2,,AnimalCrossing,"Not mine, but this is too cute not to share! ACNH nail salon"
987,honeybearposts,1594418746,hoy9cg,11,2,I just reached 5 stars today but still feel as if my island is INCREDIBLY simple. I’m wondering if anyone else felt the same way when they reached it too?,AnimalCrossing,Five Star Feelings 🤔
988,jjlin71498,1594383249,honux1,5,2,,AnimalCrossing,"North Hemisphere player, are you ready to sell fish to CJ ?"
989,thaisss25,1594412441,howe42,19,2,,AnimalCrossing,my little tokyo &amp; inspo for it 💜
990,toffeeburgerr,1594375790,homdcr,11,2,,AnimalCrossing,reecreated the cave from grave of the fireflies 🥺 all the sad feels if you get this reference
991,lotrm,1594368804,hol4dj,5,2,,AnimalCrossing,my island entrance! ☘️✨
992,Galapix,1594397873,horupy,9,2,,AnimalCrossing,"[PSA] For those of you who were like me, believing that you could only find one wasp nest a day, I just found not one, not two but THREE. I managed to catch 'em all, but they're scary."
993,spicy_pea,1594365923,hoklqz,0,2,,AnimalCrossing,Love getting the children ready for winter outings
994,barogle,1594351917,hohonz,4,2,,AnimalCrossing,I bought all the umbrellas and arranged them
995,cottonnara,1594356181,hoints,0,2,,AnimalCrossing,I let him looking at his home
996,twerk_on_that_shark,1594351807,hohnq8,1,2,,AnimalCrossing,Thank you to u/CherryTaint for the inspiration! I now have my own cute little farm area!🌱
997,NoBuenoAtAll,1594353129,hohylq,8,2,,AnimalCrossing,Anyone know what tonight's update (1.3.1) did?
998,poppytug,1594351297,hohjgv,2,2,,AnimalCrossing,I got this mermaid dress. I love this dress even though in the real world I would never wear it.
999,Juicexandski,1594358406,hoj52x,0,2,I need some inspiration for a pirate themed entrance to my island and I'm curious if anyone has made one since I haven't seen too many pirate themed  entrances,AnimalCrossing,Has anyone created someone pirate themed entrance with pirate Gulliver items?
1000,ka_hime,1594511287,hpkgat,10,7,,AnimalCrossing,Made a few bath bombs today!
1001,LandPirate93,1594481209,hpbtlo,0,5,,AnimalCrossing,Fishing tourney is getting pretty intense over here
1002,nomkakaii,1594476078,hpage5,58,4,,AnimalCrossing,Marshal- mallow✨ I illustrated Marshal as food!💖
1003,kuarancrossing,1594455031,hp6fe6,23,4,,AnimalCrossing,Arendelle inspired castle to add to my Winter Wonderland ❄️
1004,kiersforfears,1594443570,hp4bhv,3,4,,AnimalCrossing,Ketchup needle felted by me
1005,bananabelle69,1594511483,hpki5n,66,4,,AnimalCrossing,"My boyfriend has been hoarding catfish for weeks, and he finally was very excited to show me his catfishing room"
1006,27thbeam,1594489768,hpebkn,4,3,,AnimalCrossing,"5 to 1... It ain't really fair to the fish, is it?"
1007,Aphroditesbutt,1594492593,hpf53g,1,3,,AnimalCrossing,I swear every time
1008,jackthetaco,1594442747,hp45er,1,3,,AnimalCrossing,Bones and I at the aquarium :)
1009,and_peggy1776,1594488454,hpdxiw,5,3,,AnimalCrossing,Hey guys! One of my designs of one of my favorites was made into a pin!
1010,_MM7,1594485707,hpd4b9,2,3,,AnimalCrossing,I found a real life Wild Log Bench for my KK Slider!
1011,faraohno,1594455748,hp6jsj,12,3,,AnimalCrossing,Painted my favourite AC fish on my switch case!
1012,Tri4ceKid,1594485189,hpcysj,0,3,,AnimalCrossing,My experience with the Fishing Tourney is at least a C+ so far...
1013,lastjabberwocky,1594445448,hp4p1n,3,3,,AnimalCrossing,My 70s Inspired Living Room
1014,Adunkadoo,1594487181,hpdjug,15,3,,AnimalCrossing,Do I look ready for the Fishing Tourney?
1015,lxvta,1594479203,hpb9j4,3,3,,AnimalCrossing,"Blue themed park! I recently made accounts for what I usually post on here, it would mean the WORLD to me if y’all could follow me on ig and Twitter 🥺❤️⚡️ @ acnh_linn remember you are loved and cared for!"
1016,Barbaric_Fett,1594509695,hpk0zy,4,3,,AnimalCrossing,My attempt at The Starry Night painting
1017,fabsydxoxo,1594432048,hp1p0s,1,3,,AnimalCrossing,"Wanted to share this acrylic painting of marina my sister made! (she doesn’t have a reddit, I asked her permission:))"
1018,TheAwesomeYT,1594434159,hp279j,0,3,,AnimalCrossing,I could this in my friends house
1019,TunafishSandworm,1594433067,hp1xvd,2,3,,AnimalCrossing,Treesy Mae
1020,Sugar_crossing,1594498518,hpguu4,6,3,,AnimalCrossing,011
1021,Greasy56,1594456605,hp6p0f,50,3,,AnimalCrossing,Happened To Many Times
1022,Chaott,1594467246,hp8jly,121,3,,AnimalCrossing,Finally got a 1 star rating but I have no friends to share with :( Hope you all appreciate my hard work &lt;3 Love this game!!!
1023,uiuclove,1594485156,hpcyfb,3,3,,AnimalCrossing,I was so inspired by this sub and wanted to show my dispensary off!
1024,Vanilla-estSecks,1594430290,hp1a6a,33,3,,AnimalCrossing,It's enormous and I love it ❤
1025,TOOMtheRaccoon,1594488754,hpe0ph,1,3,,AnimalCrossing,Cats like fish
1026,MuffinMinecraft,1594502108,hphwib,0,3,,AnimalCrossing,"After months of searching, I finally found one of my dreamies on the first ticket of the day!"
1027,L3tzshake,1594434529,hp2ahr,0,3,,AnimalCrossing,Rivers and ponds are my favorite.
1028,Zupyta,1594468145,hp8po7,16,3,,AnimalCrossing,That moment when I found my favorite villager but I don't have a ladder...and no I don't have the diy either..
1029,aryasstark,1594449558,hp5goj,1,3,,AnimalCrossing,Fishing Tourney Day aka just me and my fellas vibin'
1030,278urmombiggay,1594432886,hp1w7m,4,3,,AnimalCrossing,definitely a never ending work in progress but heres my entrance :)
1031,lisaluvsfood,1594434078,hp26jn,6,3,,AnimalCrossing,Welcome to Milo's Hut: Dog Park + Coffee Stand
1032,mansonfamily,1594484321,hpcpi7,0,3,,AnimalCrossing,My girls enjoying the tourney
1033,KHCross,1594483770,hpcjkl,2,3,I finally got my Ironwood Dresser and Mahi Mahi!!,AnimalCrossing,I don't care about anything else today...
1034,allthingsalways,1594498179,hpgrbu,11,3,,AnimalCrossing,"I painted some of my favorites, Marina and Molly!"
1035,kiersforfears,1594508938,hpjt8m,1,3,,AnimalCrossing,My pink palace.
1036,kamata-kun,1594475773,hpado9,15,3,,AnimalCrossing,Nooks cranny is being built!
1037,xRyeven,1594443660,hp4c79,2,3,,AnimalCrossing,Probably the best photo I've ever gotten. Have a wonderful Fishing Tourney!
1038,bs000,1594490146,hpefk7,0,3,,AnimalCrossing,When you give away your secret fishing spot before the tournament.
1039,FlubGupps,1594502821,hpi3tv,17,3,,AnimalCrossing,Hi! I’m Egg from Yolk island and this is my flag☺️✨🍳
1040,lieutenant_butter13,1594434892,hp2dn8,2,3,,AnimalCrossing,I made a ketchup! (First time doing embroidery)
1041,KOsworker,1594489426,hpe828,6,3,,AnimalCrossing,I’m having a date
1042,flabblann,1594493743,hpfgxj,6,3,,AnimalCrossing,biggest accomplishment during this pandemic
1043,stephoster,1594511330,hpkgpu,2,3,,AnimalCrossing,Greenhouse Nursery Succulent Plant Trays
1044,Rhinehart58,1594459138,hp747k,5,3,,AnimalCrossing,"My birthday was 5 days ago and my villagers did this for me, I don’t have many friends so this made me feel special :)"
1045,jaimiejam,1594509966,hpk3oh,0,2,,AnimalCrossing,This little fish-shaped bag is so cute!! From the fishing tourney!
1046,Hollykw,1594473918,hp9xl2,4,2,,AnimalCrossing,When you’re too cheap for a bridge 😂
1047,MxBlobfish,1594492216,hpf144,2,2,,AnimalCrossing,"Some unlikely friends, Fauna and Diana! Fauna made Diana a cosmo crown ❤🌼"
1048,Moraloe,1594485535,hpd2ik,4,2,,AnimalCrossing,i decorated my personal switch while i wait for a save data update to transfer my island off my family’s switch!
1049,Scorchyy,1594490468,hpeixb,3,2,,AnimalCrossing,I stalked Pascal and finally discovered what he does with all these scallops
1050,mypotbelly,1594489450,hpe8an,2,2,,AnimalCrossing,Built an investigation room...Funny business going on and four suspects
1051,Citizenbeck,1594486503,hpdcn9,2,2,,AnimalCrossing,When your twin shows up to your fish tournament in the same outfit...
1052,phoebeloverr,1594486024,hpd7oi,2,2,,AnimalCrossing,Just so we’re all clear
1053,Unknown_2003,1594468897,hp8uxo,5,2,,AnimalCrossing,Scoot finally learned to fly! ...or float at least...
1054,vector_mp3,1594442886,hp46dt,0,2,,AnimalCrossing,"Might be my favorite screenshot, not sure"
1055,AceTheSandman,1594429073,hp0zmh,1,2,,AnimalCrossing,Oof
1056,Renmux,1594447290,hp51nc,0,2,,AnimalCrossing,Midnight in the museum
1057,Illuminaura,1594475723,hpad8a,0,2,,AnimalCrossing,It'd wake me up
1058,asheetaylor,1594439083,hp3cp7,2,2,,AnimalCrossing,She needs to be kept safe at all costs
1059,Plazby,1594474860,hpa5me,0,2,,AnimalCrossing,Made a cafe reffed from someone else on this subreddit who was inspired by someone else also
1060,Cotton-Candy-Lion,1594475915,hpaex1,0,2,,AnimalCrossing,Moonlight yoga anyone?
1061,peekabluuu,1594492045,hpezc4,0,2,,AnimalCrossing,"After doing my daily rounds I came across a lily of the valley, went to see Isabelle and confirmed the news! Soo happy!🥳"
1062,snoozylady,1594492542,hpf4kn,0,2,,AnimalCrossing,Thrilled to enjoy a restful weekend in my at-home spa 🧖🏻‍♀️
1063,deppressing_diabetic,1594496374,hpg8k3,0,2,,AnimalCrossing,Mathilda is moving does anyone want her im taking offers
1064,KnowNoDada,1594441671,hp3xaf,1,2,,AnimalCrossing,Took my best girl Marina out for a drive
1065,_Andude_,1594439371,hp3ez3,1,2,,AnimalCrossing,Dom thinks Audie smells good now ❤️
1066,Sugar_crossing,1594498386,hpgtgz,0,2,,AnimalCrossing,Welcome to Hawkins✨
1067,black0utcity,1594494367,hpfniu,0,2,,AnimalCrossing,Pascal searching for scallops! 🐚
1068,edenspresence,1594456987,hp6rdo,4,2,,AnimalCrossing,Night swimming under shooting stars
1069,Rade_2814,1594506832,hpj8kf,0,2,,AnimalCrossing,"Team Blue, Team Green, Team Red, Team Didn't Get the Memo."
