,author,created_utc,id,num_comments,score,selftext,subreddit,title
2268,octopuschochin,1595533931,hwmpzi,25,279,,AnimalCrossing,Drew a peaceful corner of my island the other day and turns out it was the last day for hydrangeas!
2269,_Z_E_R_O,1595525759,hwk2f2,10,275,,AnimalCrossing,"Whatever you say, Blathers"
2270,acnh-winkerton,1595542678,hwpe6n,22,273,,AnimalCrossing,Three times a day every day
2271,cassidy630,1595467020,hw6gx1,82,269,,AnimalCrossing,"I think the mouse villagers design is super cute, but their individual designs are horrible, so got bored and tried to create a new cuter looking one (it’s not great I know, just got bored)"
2272,WilkoAmy,1595523264,hwj8rx,40,268,,AnimalCrossing,"So this is my first time making custom designs, idk if they’re good or not but hope you like them💛"
2273,karengucci,1595529429,hwl90h,13,266,,AnimalCrossing,Judy : •-• a butt
2274,queenieo,1595505635,hwee4o,25,260,,AnimalCrossing,The way their high and low voices harmonise
2275,airb92,1595537113,hwnqom,55,256,,AnimalCrossing,MY GOLDEN GIRLS SET
2276,SuperquooL,1595521615,hwipqa,25,251,,AnimalCrossing,"Diana finally asked for a new catchphrase, and it was worth the wait."
2277,kindaamess,1595540933,hwov0o,23,249,,AnimalCrossing,Oh
2278,SwinubIsDivinub,1595514331,hwgjy5,22,247,,AnimalCrossing,"I didn’t have Sherb to give a nice blue garden to, so I BECAME Sherb"
2279,[deleted],1595519892,hwi66a,181,231,[deleted],AnimalCrossing,"Beyond disgusted to find this hanging in my shop. Beware, done by Maxwell from Cozy Isles. He asked to come check out ables... I’m so glad you can report it and it disappears."
2280,PinkBananaBlue,1595531035,hwlsd8,22,228,,AnimalCrossing,Home office down in the basement
2281,SnowyLionnn,1595535344,hwn6s1,19,225,,AnimalCrossing,are you okay cookie
2282,Bendoza,1595522261,hwix7p,8,218,,AnimalCrossing,I finally gathered all my rocks and made a mining quarry I’m happy with :)
2283,may88772003,1595471921,hw7p0o,12,215,,AnimalCrossing,Today is Chow's birthday and nothing can stop my best friend celebrate for him...yep even she's laboring 😂 happy birthday Chow and Alisa💛
2284,Natttiee,1595475536,hw8kia,30,214,,AnimalCrossing,Getting my beach resort ready for when the snow melts 💕🌴
2285,sokerikko,1595494077,hwc93i,15,213,,AnimalCrossing,I drew Marina as a mermaid princess!
2286,abnormallyme,1595514459,hwgl95,24,213,,AnimalCrossing,I think Bluebear just gave me her child...
2287,mysingingskylander17,1595532657,hwmb1u,13,205,,AnimalCrossing,Using a Nook miles ticket and found an Onix.
2288,getoffmylaaawn,1595466266,hw69ut,14,191,,AnimalCrossing,"Went to my friend's island, and this happened 😂"
2289,kendramadallama,1595469903,hw774e,26,184,,AnimalCrossing,First attempt at (non-cross stitch) embroidery. I’m obsessed with animal crossing so I made Celeste! It’s not perfect but I’m happy with it. OC
2290,a-crossing,1595469605,hw74bk,8,184,,AnimalCrossing,Great Fairy Fountain 🧚🏼‍♀️ (sound on)
2291,PudgyPudgePudge,1595464891,hw5wv9,35,183,,AnimalCrossing,I drew some of my fave villagers on some blank cards!
2292,MotherOfWoomy,1595511068,hwfoht,23,175,,AnimalCrossing,Sherb sings Stale Cupcakes and Kidd comes in to dance along ❤️💖
2293,Better_WithToast,1595508112,hwey85,11,174,,AnimalCrossing,Tangy as an orange chocolate piece and orange soft serve.
2294,AliCatACNH,1595511315,hwfr8a,36,172,,AnimalCrossing,I recently redid my entire island and I wanted to share my progress! These are some of my favorite spots.
2295,ugctkit,1595472323,hw7sjx,48,172,,AnimalCrossing,"Gee, thanks Wisp..."
2296,[deleted],1595504736,hwe7ki,8,169,[deleted],AnimalCrossing,Someone asked for a simple layout of how I recreated the Trevi Fountain so I made this. Forgive the messy sketch! Hope this is clear enough for anyone who wants to recreate it in their islands.
2297,onionrah,1595466979,hw6gkh,14,166,,AnimalCrossing,We had a very important meeting about who to invite to the island next!
2298,Sindiful,1595519654,hwi3ho,11,161,,AnimalCrossing,Doing the shovel spin lag dance.
2299,nomon_bamboo,1595537574,hwnvm7,2,159,,AnimalCrossing,Pascal supports good mental health practices
2300,neilslorance,1595599103,hx28ss,659,27391,,AnimalCrossing,I saw Molly reading to a turtle today and got a bit carried away.
2301,misspopricorn,1595586411,hwzdcl,72,6082,,AnimalCrossing,Someones Hungry...
2302,tiara_king,1595614477,hx6x0w,408,4131,,AnimalCrossing,“The Water Lily Pond” by Claude Monet 🌿🍃
2303,cindyfromwonderland,1595591262,hx0byc,208,3962,,AnimalCrossing,Finally I made Animal Crossing cake 🌸
2304,QueenBeanyy,1595618943,hx8bcl,245,3149,,AnimalCrossing,My idea of how you get back home when attacked by tarantula or scorpion❤️ (OC)
2305,jessicadiamonds,1595604504,hx3sev,187,2188,,AnimalCrossing,Stop judging me you alcoholic waterfowl.
2306,adrikovitch,1595620498,hx8s5s,250,2184,,AnimalCrossing,"I made a fun ""printing"" process of my friend's oil painting as the digital part of his Animal Crossing themed birthday present!"
2307,inchtheworm3,1595564161,hwv25j,114,1678,,AnimalCrossing,I made these earrings and I'm so excited about them 😭
2308,TigerDoodle,1595560682,hwu80e,108,1645,,AnimalCrossing,I finished painting the first shoe and I'm so happy with it AHHH
2309,lovelysanni,1595574556,hwx9uj,114,1497,,AnimalCrossing,finally completed my island! thought i’d share the map :D
2310,fuqqqqinghell,1595630264,hxbk56,205,965,,AnimalCrossing,Realistic Ketchup Fanart
2311,ConcernedPotato,1595619656,hx8j91,147,940,,AnimalCrossing,I got all my villagers' original clothing to match with them &lt;3
2312,bienchanter,1595598893,hx26vd,98,844,,AnimalCrossing,I have no regrets
2313,Breathoflife727,1595554462,hwsnt5,62,778,,AnimalCrossing,I interrupt your regular scrolling to bring you...toe beans!
2314,Juliusdasquid,1595588601,hwzs2g,24,667,,AnimalCrossing,Rover = best cat
2315,elchewbaccabra,1595591245,hx0btp,48,650,,AnimalCrossing,Can’t catch this one
2316,sailorart,1595569787,hwwaqr,78,601,,AnimalCrossing,"(Edited by me) I shared this on a different subreddit, however I was nervous to do it on the larger one! Hope whoever sees it likes it!"
2317,michiemarshall,1595623278,hx9nfz,141,558,,AnimalCrossing,designed some villagers as kingz and queens 🥰🤴
2318,spacenarwhal0101,1595611809,hx61u5,23,529,,AnimalCrossing,On-the-job training with Blathers
2319,SwixSwax,1595613486,hx6kwr,48,508,,AnimalCrossing,You guys I think Flick needs glasses
2320,latentximage,1595626415,hxakja,84,457,,AnimalCrossing,Here is my diving/swim/surf area!
2321,victato,1595559700,hwtzik,97,453,,AnimalCrossing,I recreated the Brooklyn Nine-Nine marshmallow scene in Animal Crossing
2322,newmomwhodis,1595605369,hx41n2,45,446,,AnimalCrossing,Painted Judy with watercolors ☺️🌸
2323,NarcolepticFuni,1595553514,hwsf01,65,434,,AnimalCrossing,Finally collected all of K.K.'s tracks for my music room
2324,SwixSwax,1595598527,hx23hb,27,429,,AnimalCrossing,Thank you for your service
2325,Kippythecat,1595634382,hxcnvr,100,386,,AnimalCrossing,Bella and Fuschia as humans! [OC]
2326,doubutsuno_mori,1595557925,hwtjs2,30,374,,AnimalCrossing,My take on a retro laundromat!
2327,theacornfromiceage,1595621519,hx93tr,72,370,,AnimalCrossing,i wanted to share my aerial shot with someone cause none of my friends play animal crossing anymore 🥺
2328,Hinataicygirl14,1595621923,hx983r,18,368,,AnimalCrossing,Let that sink into your brain 🧠!
2329,asenceana,1595558315,hwtnbr,57,367,,AnimalCrossing,OC- Crafted an AC dock cover and game organiser &lt;3
2330,AJ2020Red,1595597696,hx1w07,578,316,,AnimalCrossing,Fun exercise: What’s your toxic animal crossing trait? Mine is refusing to craft my own tools and wasting bells for Nooks’ instead (minus golden tools)
2331,Thomaspden,1595594144,hx0zmw,30,298,,AnimalCrossing,Spent far too long trying to make this little stepping stone in the shape of Redd's face
2332,misspopricorn,1595581545,hwyifq,36,296,,AnimalCrossing,My Completed Campsite!
2333,drengibami,1595567650,hwvu3w,28,295,,AnimalCrossing,Why is the closing music so sad?
2334,seacucmbers,1595566956,hwvool,35,293,,AnimalCrossing,Backup Dancer Merengue!
2335,chipolthey,1595555659,hwsyrz,41,287,,AnimalCrossing,Recreated the Nintendo Store!
2336,dakneees,1595550426,hwrlt0,31,261,,AnimalCrossing,Entrance to my new island! I restarted my game more than a week ago. I hope you guys like it :)
2337,sakuraislandAC,1595587741,hwzm4n,44,256,,AnimalCrossing,It's such a beautiful snowy evening ❄🚲
2338,alicatp,1595559210,hwtvab,76,256,,AnimalCrossing,"my little sister lost my wild world game cartridge years ago, but today my mom found it while fixing up the yard preparing our family home to be sold. don't mind me crying over a broken ds cartridge."
2339,Merlusch,1595574570,hwx9y7,25,253,,AnimalCrossing,Welcome to Brand New Animal crossing
2340,RJskillz92,1595600594,hx2niv,41,253,,AnimalCrossing,"Agnes, Ketchup and Lyman work hard to prepare for the 1988 Crystal Light National Aerobic Championship"
2341,coastalpostalmha,1595596892,hx1oex,34,240,,AnimalCrossing,I finally finished my train station!
2342,xlexarose,1595626423,hxakm4,51,236,,AnimalCrossing,Some little AC terrariums I just finished up 🍄🍃🌞
2343,lochjessmonster,1595579453,hwy5fi,28,231,,AnimalCrossing,The entrance to my “secret” beach is behind my library
2344,[deleted],1595609319,hx5ajo,39,227,[deleted],AnimalCrossing,“The Water Lily Pond” by Claude Monet 🌿🍃
2345,twerk_on_that_shark,1595607303,hx4mwg,33,216,,AnimalCrossing,Finished a simple iris themed set for my first Able’s shop display. MA-6868-9100-2516
2346,lilyofthev4lley,1595607654,hx4qnp,29,201,,AnimalCrossing,You ever take a picture so cute on New Horizons you want to print it out and frame it?
2347,IchigoShiro,1595581892,hwykme,54,198,,AnimalCrossing,I am so happy! My island isn't special like most people's but I am rly happy with this! 💕💐
2348,Sunmoonflowerssky,1595560781,hwu8w2,23,189,,AnimalCrossing,I made this DIY kitchen kit from Robotime and Celeste fits right in. It’s as if it was made for her!
2349,ReneeLeilani,1595626118,hxahgw,39,185,,AnimalCrossing,Celeste visited last night ✨ she’s so precious I wish she visited more often!
2350,Ak-Xo,1595551615,hwrx5w,30,184,,AnimalCrossing,I attempted the NH main theme on the piano!
2351,_cinnamon_buns,1595569935,hwwbvl,44,179,,AnimalCrossing,My bedroom is just super peaceful
2352,RaicKez,1595594959,hx16ry,39,178,,AnimalCrossing,I made 3D printed Zucker
2353,jae_iin,1595618026,hx80vl,14,162,,AnimalCrossing,"“I’m dreaming, I’m dreaming!” - Spirited Away (2001)"
2354,_Smol_Turnip_,1595587972,hwznnd,6,160,,AnimalCrossing,"Molly in the rain (villager request 2, thank you u/person0000001)"
2355,blek_blek,1595591194,hx0bgp,3,153,,AnimalCrossing,Stop spying Dom or else.. [credit: @monikoro5 on Twitter]
2356,_Bash_The_Trash,1595559844,hwu0r9,16,150,,AnimalCrossing,I 3-D printed a whole freaking couch
2357,alexskyeb,1595625651,hxacp8,37,138,,AnimalCrossing,“Eleanor? Come on in.”
2358,PJStubbs,1595609903,hx5guu,67,129,,AnimalCrossing,FYI if you are done with fossils you can decoratively bury 6 and they won’t spawn anymore!
2359,BaffleBlend,1595619589,hx8ihc,44,128,,AnimalCrossing,This sub's worst nightmare
2360,Acirelav,1595601562,hx2x7a,18,127,,AnimalCrossing,My take on the Zelda - Breath of the Wild rock circle 🙃
2361,NemoHobbits,1595627101,hxaqxn,33,126,,AnimalCrossing,I made a swamp. It's not much but I'm pleased with it.
2362,user001414,1595634885,hxcsl3,20,126,,AnimalCrossing,modern white kitchen ☕️☁️
2363,audreyypan28,1595553834,hwshx0,10,124,,AnimalCrossing,Social distancing in animal crossing 😎
2364,cchloealexandra,1595615925,hx7d5g,29,122,,AnimalCrossing,I love my kitchen so far!!! 🌵🌿✨
2365,Brainfeeder777,1595612674,hx6bhz,14,119,,AnimalCrossing,Cute Skull Waterfall
2366,HuskerGirlKC,1595568990,hww4j8,9,118,,AnimalCrossing,I knew the walls of my home were thin. This is how rumors start.
2367,brotato-tot,1595617320,hx7sq8,21,117,,AnimalCrossing,can’t believe i caught this on camera 🥺😭
2368,Joecarlin,1595549194,hwraat,29,116,,AnimalCrossing,Oh ok...
2369,esushi,1595595913,hx1feu,2,115,,AnimalCrossing,Timmy &amp; Tommy be like
2370,Snoo91275,1595586634,hwzeri,18,113,,AnimalCrossing,It happened!!!!
2371,AnnieLesra,1595577904,hwxvkq,12,112,,AnimalCrossing,"After villager hunting for ages, I finally got the golden trio!"
2372,Mudron,1595556227,hwt458,34,108,,AnimalCrossing,Anyone else get these clouds for the first time tonight?
2373,KindaWorking,1595572886,hwwy3c,31,107,,AnimalCrossing,I designed a pin as a thank you to my Animal Crossing friends that have kept me sane during this crazy time.
2374,dsalvati,1595552756,hws84u,9,105,,AnimalCrossing,Gotta Love the Writing
2375,eggitlog,1595550381,hwrlea,9,105,,AnimalCrossing,"Just started acnh last month, and redid my entrance so many times. I think this is the one? What do you guys think? :)"
2376,MrFezon,1595588521,hwzrgy,26,101,,AnimalCrossing,Posting a picture of Roald everyday until he moves to my island / day 35
2377,azfjm,1595627136,hxar8x,10,99,,AnimalCrossing,My yellow ironwood kitchen!
2378,lochjessmonster,1595592959,hx0ppu,11,97,,AnimalCrossing,"Just another day in the retirement home. Mom is too busy writing letters, but the dads are here."
2379,JudeFlower97,1595597268,hx1s1w,8,95,,AnimalCrossing,Thought y'all might appreciate this gold I stumbled upon
2380,sixelabalexis,1595616631,hx7ksk,13,93,,AnimalCrossing,"finally, after 2 MONTHS of watching and waiting, I finally saw Kiki sitting in the rocking chair I placed for her 😭"
2381,IgnoramusPolymath,1595617532,hx7v74,6,92,,AnimalCrossing,"I know it's generic dialogue for all art, but I feel like this was written for exactly this situation"
2382,madame-depompadour,1595612806,hx6cwo,6,89,,AnimalCrossing,My husband created a “behind the scene” of The Birth of Venus. I’m Venus.
2383,th-gr8-swagsby,1595580542,hwycac,8,88,,AnimalCrossing,Nan has a perfect garden - legit my fave little flowers in game and IRL
2384,hannah89012,1595604984,hx3xhg,12,88,,AnimalCrossing,A Japanese neighborhood inspired by the Gion district in Kyoto
2385,cat-litter,1595623732,hx9seb,11,88,,AnimalCrossing,I completed the mermaid set
2386,jkskulski,1595628245,hxb1iu,14,87,,AnimalCrossing,Getting ready for Red Sox Opening Day from my Virtual Green Monster Seats.
2387,Great-white-shark-,1595569407,hww7yg,10,87,,AnimalCrossing,My playground with tricycle track is finally completed.
2388,ColorsOfYou,1595558740,hwtr22,21,87,,AnimalCrossing,Before and after of my campsite
2389,AngelaRansley,1595611327,hx5wle,60,87,,AnimalCrossing,"322K HHA rating, going strong for the almighty 400k! What is your favourite room?"
2390,Tom_Cody,1595593426,hx0tic,5,87,,AnimalCrossing,"I normally stick to r/boxing, but i thought y'all would enjoy my boxing arena"
2391,tarantulafriends,1595548912,hwr7mc,20,84,,AnimalCrossing,Gayle’s portrait! She’s acrylic on illustration board.
2392,MysteriousRoll,1595606029,hx48kz,6,84,,AnimalCrossing,Friends: How are you doing? Me:
2393,tipmama,1595622801,hx9hw1,23,82,,AnimalCrossing,We love a good island flag.
2394,nadinyaa,1595620055,hx8njy,9,82,,AnimalCrossing,Made another small Animation ✨
2395,LittleA92,1595595078,hx17tj,2,81,,AnimalCrossing,I love how the Leo Sculpture goes with the pirate wall 😍
2396,jamboy1255,1595555892,hwt0x6,2,79,,AnimalCrossing,I designed a photoshop background for laptops and computers. I hope people find use of this
2397,ChaseDaSinger,1595568690,hww29b,14,78,,AnimalCrossing,Been waiting all month to get the hedge recipe just so I could make............. Stone-hedge
2398,2_deep,1595604202,hx3p31,18,77,,AnimalCrossing,Really proud of how my little diner came together
2399,vitamin_fluff,1595549196,hwrabp,6,77,,AnimalCrossing,"I’ve been working on the COVID unit for the last 5 months and play ACNH on my breaks. Today I got a letter from Ruby, which happens to be my pet bunny’s name. 😭"
2400,susubgugu,1595639205,hxdwj3,139,477,,AnimalCrossing,Henry hopes there will be a chinchilla villager one day!
2401,PastorJo,1595652961,hxh2ii,67,445,,AnimalCrossing,"After an extremely long day, broken down car, my four year old sent me a letter and I’m reminded why it’s all worth it"
2402,dinglemydongles,1595646378,hxfm3o,45,331,,AnimalCrossing,Spare scallops? Spare scallops maaan? [OC]
2403,ChocoFowl,1595649225,hxg946,171,318,,AnimalCrossing,Celeste being the baddest B on this island
2404,suckyninja,1595636118,hxd44k,19,185,,AnimalCrossing,My husband held up the balloon and gave me a dart and made wind sound effects so I could pop it. It some other small fun things in the box but we've been planning on going to ikea so I can get a vanity for my birthday gift for a while. So this leaf was the *chef's kiss*
2405,smolbeanfriend,1595635925,hxd2aa,10,155,,AnimalCrossing,Made a teensy lil Gulliver for fun 💙
2406,islafancyliving,1595652064,hxgvlh,41,153,,AnimalCrossing,"It's Britney, Bitch"
2407,crumbsicle,1595653587,hxh6ye,18,152,,AnimalCrossing,Heh.
2408,dgmqt,1595648622,hxg4ek,35,148,,AnimalCrossing,I gave Beau some Alpinist Overalls because I thought it’d look cute on him and it did NOT disappoint🥺
2409,DragonDeku,1595654427,hxhcvx,91,147,,AnimalCrossing,Every time
2410,sansheeb,1595647823,hxfy0h,56,146,,AnimalCrossing,Wanted to share this Appa I drew as a villager ☺️
2411,ErinCookie,1595636836,hxdanm,24,121,,AnimalCrossing,"Octopus See, Octopus Do"
2412,ashleeping,1595649254,hxg9d4,76,115,,AnimalCrossing,made a mini post office!
2413,thebikefortwo,1595647696,hxfx1c,38,113,,AnimalCrossing,nighttime routine 🌺✨ sleep tight
2414,iamtheyeezy,1595641797,hxej5z,4,96,,AnimalCrossing,Finished my moon courtyard 🌙
2415,grubby-tubby,1595644692,hxf83k,15,89,,AnimalCrossing,I made a zoo for my museum entrance. Welcome to the Hakuna Zoo!
2416,somanycherries,1595642416,hxeoga,11,85,,AnimalCrossing,Antique.
2417,CaramelWaifu,1595652656,hxh06k,19,84,,AnimalCrossing,A picture from my Aquarium date with my long distance baby. Just want to see him. 😔✨
2418,stu48fan,1595663457,hxj08z,181,84,,AnimalCrossing,"THE MOON, THE BEAR, AND THE BIG BLUE HOUSE, WILL BE WAITING FOR YOU TO COME AND PLAY (to come and play) - I posted this already on twitter but I thought I’d share here too because I’m really proud ahaha"
2419,thebikefortwo,1595647628,hxfwgv,17,75,,AnimalCrossing,best feeling ever!! omg
2420,sansheeb,1595652894,hxh22g,10,75,,AnimalCrossing,finished version of my villager style appa 🥰
2421,dokdo_moon,1595636870,hxdayf,22,75,,AnimalCrossing,My finished entrance! Shoutout to all you kind souls on here :)
2422,swellboi,1595641596,hxehjg,29,75,,AnimalCrossing,Does this mean I beat the game?
2423,lostgiraff3,1595638427,hxdpa7,25,75,,AnimalCrossing,"This has been the worst work week of mine and my coworkers lives. I started crying as soon as I read this. Just what I needed, Isabelle💖"
2424,thawmyfrozen,1595648820,hxg5wk,29,74,,AnimalCrossing,Can you report stalking to Isabelle?
2425,ashleeping,1595654088,hxhaje,39,74,,AnimalCrossing,a path to marketplace
2426,mattebabygirl,1595641752,hxeitb,0,64,,AnimalCrossing,still counts.
2427,lnfrly,1595636341,hxd65k,14,61,,AnimalCrossing,Someone finally sat on my little crescent moon walkway!
2428,xlukax,1595651527,hxgrg0,28,59,,AnimalCrossing,My dumbass thought i finally got 5 stars
2429,Dia-kurosawa1,1595643196,hxevg6,19,59,,AnimalCrossing,I finally did it!
2430,Jaqqs_,1595640476,hxe7p6,17,58,,AnimalCrossing,my howl’s moving castle themed island!
2431,sillymocha05,1595648659,hxg4oh,19,55,,AnimalCrossing,(Attempted) To make some Timmy and Tommy cupcakes!
2432,alcycul,1595641565,hxeh8u,7,54,,AnimalCrossing,I’m not creative enough to have ideas for new areas but you bet I’ll design my beach bar over and over
2433,muiyanyan,1595649571,hxgbw2,9,54,,AnimalCrossing,"My ""Mom's Chess"" area 😊"
2434,mollywobbles1116,1595646993,hxfrbv,24,53,,AnimalCrossing,"Wanted to make a sim that looked like my fave villager, Coco and this is what I came out with."
2435,chintyawn,1595651610,hxgs4o,14,51,,AnimalCrossing,My friend takes better photos of my Cute Dino/jurassic park
2436,chypohondriac,1595648007,hxfzjd,7,48,,AnimalCrossing,My first attempt at a clothing line!! :)
2437,allthingsalways,1595640001,hxe3eu,6,47,,AnimalCrossing,Today I painted Marshal in watercolor
2438,kemijskasan,1595641498,hxegnq,4,44,,AnimalCrossing,The Sixth Station from Spirited Away
2439,Akumora,1595655377,hxhjgm,20,43,,AnimalCrossing,A Hornsby Painting for a friend who’s been stressed out!
2440,franktheman101,1595663995,hxj3lu,16,42,,AnimalCrossing,my grandpa made me merangue inspired cake bc i told him she was my favourite character
2441,Candy-Ashes,1595660238,hxifqx,7,42,,AnimalCrossing,My rock circle's looking great
2442,Iosuaaa,1595653916,hxh9cz,0,42,,AnimalCrossing,I finally finished my Blackpink room in my house! It took ALLLLLL dayyyyyy. Ugh. Lol but she's cute!
2443,thebikefortwo,1595647602,hxfw9k,19,42,,AnimalCrossing,my trick to catching extra fast sea creatures 👀 just sneak!!
2444,Rhymelie,1595655794,hxhmfw,12,41,,AnimalCrossing,Got this in the mail the day after giving up on my work out routine because I wasn't seeing results. Guess who's back on that work out routine now because of a silly letter from a video game?
2445,Killer8omb,1595667008,hxjloe,35,40,,AnimalCrossing,They have been setting together for the last 2 hours 🥺
2446,smarieannachu,1595655364,hxhjcr,9,39,,AnimalCrossing,Tried making some oatmeal Nookling cookies today!
2447,ChaseDaSinger,1595638935,hxdtvu,0,38,,AnimalCrossing,"Thanks for rubbing it in, Stu."
2448,iheartkiwi,1595656594,hxhrtd,31,36,,AnimalCrossing,Working on small areas around the island tonight. What y'all doing?
2449,AnOwlsTale,1595641553,hxeh52,0,35,,AnimalCrossing,Experimenting with braided path designs!
2450,geomotus,1595663047,hxixv6,6,35,,AnimalCrossing,"Dreaming of home, the lonely isopod"
2451,kundabni,1595639541,hxdzfc,0,34,,AnimalCrossing,I’m one with the orange! 🍊
2452,lemonicedboxcookies,1595643049,hxeu83,8,34,,AnimalCrossing,"Natural lighting, modern kitchen🌾"
2453,sodamoon,1595654175,hxhb3e,9,34,,AnimalCrossing,my cranky boys doing some yoga
2454,Mysticamii_spook,1595637383,hxdfoh,10,33,,AnimalCrossing,Got these made they’re adorable!
2455,ulliell,1595637235,hxdeby,4,33,,AnimalCrossing,Nice to see that I’m not the only one who needs to mentally prepare before having friends over
2456,Sauceofamy,1595656495,hxhr5i,47,32,,AnimalCrossing,"My “The Shining” inspired hedge maze. It’s a work in progress, but I’m digging it so far. What else should I add?"
2457,paulagwynn14,1595655317,hxhj1m,8,32,,AnimalCrossing,400+ hours of gameplay leading up to this.. I'm satisfied 🤩
2458,magztralala,1595645373,hxfdsm,14,31,,AnimalCrossing,"After weeks of grooming her, it finally happened."
2459,kirshind,1595641161,hxedpz,6,31,,AnimalCrossing,"favorite part of my island! 🗽 ps: aurora australis is just ...lovely, it melts my heart 🌉♥️🌌 show me yours 👇🏻"
2460,Mmminzzzz,1595641338,hxefak,22,31,,AnimalCrossing,I think I play to much? But 2k hours lets go
2461,Sauceofamy,1595654483,hxhda4,9,31,,AnimalCrossing,"Cool cool cool. Totally normal stuff, Pietro. Totally normal."
2462,christ_95,1595646570,hxfnn6,8,31,,AnimalCrossing,"OC You weren't expecting the Spanish Inquisition, were you?"
2463,Nama_Meme,1595655649,hxhlf2,0,30,,AnimalCrossing,Stiches and Judy Went fishing together❤
2464,noamshomsky,1595655201,hxhi93,6,28,,AnimalCrossing,"I was so excited when Molly moved in last month, I gifted her this halo. She finally wore it 🥺"
2465,Bobtail1234,1595657149,hxhvnt,10,27,,AnimalCrossing,Finished my photo bridge!
2466,crebekk,1595637664,hxdid9,2,27,,AnimalCrossing,gave Sprinkles some glasses as a gift... accidentally made her into a terrifying plague doctor
2467,Straightchorro69,1595645114,hxfbmw,8,27,,AnimalCrossing,How I wanna be w/ my girlfriend rn. 😔
2468,fine-kettle_of_fish,1595636185,hxd4r1,0,27,,AnimalCrossing,Ahh yes... the sacred rat
2469,caewien,1595651360,hxgq52,3,27,,AnimalCrossing,"this clown boy deserves more love, so i drew me and him : )"
2470,Complete_Loss1895,1595645817,hxfheg,13,26,,AnimalCrossing,My husband bought me some furniture today.
2471,LacedDainty,1595643792,hxf0f4,7,26,,AnimalCrossing,The lighting in this game is incredible! My enchanted rose really pops 🥰.
2472,peachespies,1595635262,hxcw29,0,26,,AnimalCrossing,Happy International Self-Care Day✨
2473,emoomin,1595638037,hxdlpt,2,25,,AnimalCrossing,These geodes that look like animal crossing fossils
2474,kennystrife,1595640565,hxe8hb,4,25,,AnimalCrossing,"Pietro's my favorite villager, so I made him the Amiibo he deserves. He's functional too!"
2475,VeronicaACNH232,1595636010,hxd32j,10,25,,AnimalCrossing,I’m not good at drawing but I drew Celeste as a human a couple days ago and though I’d share it all with you! Don’t hate please 💕🥺
2476,EntWife7,1595636959,hxdbri,4,24,,AnimalCrossing,"Just had to share with the group, today I found out my island is now 5 stars thanks to this little beauty! I thought I had such a long road but the gold watering can is mine!"
2477,AuroraArt,1595656005,hxhnvz,0,24,,AnimalCrossing,This has probably been done before
2478,thebikefortwo,1595647659,hxfwq9,6,24,,AnimalCrossing,"hey, a+ for effort, bangle 🥺"
2479,Quin_V,1595635446,hxcxqm,18,23,,AnimalCrossing,I eavesdropped on this conversation between Portia and Raymond...
2480,TheFinalGirl84,1595641103,hxed8e,4,23,,AnimalCrossing,Same Girl...
2481,leenybabe,1595640770,hxeacl,0,23,,AnimalCrossing,What a beautiful night to summon some demons.
