,author,created_utc,id,num_comments,score,selftext,subreddit,title
0,Icairy,1593613135,hjb2c4,13,22,,AnimalCrossing,"Bones, please never change"
1,alleesaurus,1593613045,hjb1bb,47,22,,AnimalCrossing,"The rainy days in Animal Crossing are my favorites, so I made some art inspired by it (feat Freya and Lolly)!"
2,SketchFarm,1593613889,hjbb0s,34,17,,AnimalCrossing,"Had to draw this room, I love sitting in the Butterfly Garden"
3,Sir_Benjamus,1593612323,hjatfq,93,17,,AnimalCrossing,"Isabelle didn't think it was worth mentioning, but Happy Canada Day!"
4,Gahrenn,1593616166,hjc1rq,117,16,,AnimalCrossing,I just wanna buy some art.
5,emmastory,1593611674,hjamae,83,16,,AnimalCrossing,"I, too, have made a ramen bar #sendnoods"
6,cyd1997,1593612194,hjas1k,11,16,,AnimalCrossing,My new rock garden 🥰
7,jodibwithoutane,1593613028,hjb14g,25,16,,AnimalCrossing,No more sea bass. Society has progressed past the need for sea bass.
8,CoffeeCup101,1593613042,hjb1ad,1,15,,AnimalCrossing,I saw someone put a fountain in their house and it inspired me to turn my main room into a castle courtyard. I love how it turned out!
9,courteliza,1593614334,hjbg9j,11,15,,AnimalCrossing,I made a cross stitch of my favorite stargazer! Pattern by PinkBabyCabbage on Etsy 🌙💫
10,Broxy712,1593613176,hjb2sc,2,14,,AnimalCrossing,After all these months I’m still crap at catching bugs on trees...
11,bellybeane,1593616572,hjc6ll,2,14,,AnimalCrossing,i meannn.....
12,THE_SHOES,1593612523,hjavnp,0,14,,AnimalCrossing,I finally finished my community rainbow garden!
13,mershrerm,1593613969,hjbc04,6,13,,AnimalCrossing,Thought about building an ice castle and found that I just couldn't let it go
14,underthepeachmoon,1593614166,hjbe8o,0,13,,AnimalCrossing,I’ve been working on redoing my villagers yards. Here is Hazel’s!
15,NicoleyRavolli,1593612665,hjax89,0,13,,AnimalCrossing,Captured the most perfect photo of Celeste in my star gazing area 🥰💫
16,leslieknope013,1593613103,hjb1yv,3,13,,AnimalCrossing,whoops
17,CMDudaPunk,1593612342,hjatn3,3,12,,AnimalCrossing,"Got the Wooden Duck DIY today, had to do this"
18,acmoni,1593614263,hjbffj,6,12,,AnimalCrossing,"Lucky day... 1st NMT 😄 we had 26 tickets (my son and me) and we were like, ok, let's find someone cute maybe the 26 tickets will be enough 😁"
19,char_cat,1593613621,hjb7t6,2,12,,AnimalCrossing,**Flora canonically commits tax fraud**
20,kedcat,1593613133,hjb2bq,0,12,,AnimalCrossing,Cute moment with Lolly and Stitches
21,xmenlim,1593611668,hjam7g,6,12,,AnimalCrossing,That feeling when a villager ACTUALLY uses the furniture you placed outside for them! :))
22,Dreamarche,1593616565,hjc6it,5,12,,AnimalCrossing,Happy Canada day!
23,francisjairam16,1593616456,hjc5bb,2,12,,AnimalCrossing,Well it took 3 months but I've finally caught the ocean sunfish. Seriously this thing is massive!
24,midlyoverwhelmed,1593617187,hjcdtx,34,12,,AnimalCrossing,Just wanted to show off my little animal crossing corner
25,camilalala-,1593615034,hjbodf,1,12,,AnimalCrossing,Bubblegum K.K. fanart by me ☺️
26,AbeWheels,1593615453,hjbt7k,17,11,,AnimalCrossing,"Expected to use tons of bait to find this lad, but found him with one!"
27,Alexibinks,1593616790,hjc94v,0,11,,AnimalCrossing,"I remade ""You"" on Netflix"
28,mymexicanshrek,1593612460,hjauxh,0,11,,AnimalCrossing,BLATHERS get in here
29,Eestherrrrr,1593612563,hjaw4o,0,11,,AnimalCrossing,qwq
30,thealphabetsayshi,1593613946,hjbbp0,22,11,,AnimalCrossing,"please, i haven't seen any island design posts in DAYS because all i see is this."
31,Icairy,1593613717,hjb8x5,0,11,,AnimalCrossing,"You know, I'm something of a fashion model myself"
32,breangregor,1593616516,hjc606,2,10,,AnimalCrossing,discovered something interesting in Graham’s house....
33,Who_StoleMyKellogs,1593617676,hjcjo8,6,10,,AnimalCrossing,I finished terraforming a small section of my island and thought I’d share it 😊
34,gtspeed9,1593617827,hjclex,2,10,,AnimalCrossing,My favorite fishing spot.
35,Icairy,1593613210,hjb35v,0,10,,AnimalCrossing,"I didn't know what Whitney thought of me, until now"
36,Alexibinks,1593617018,hjcbv8,8,10,,AnimalCrossing,"I didn't know how to post multiple. I remade ""You"" on Netflix. (Beck even has a bucket too in the back so don't worry) and I know Joe's hair is brown. It was just effort to leave harvs island to change it on my other account 😂"
37,whered_yougo,1593612001,hjaps4,63,10,,AnimalCrossing,"Me going Villager Hunting: I ONLY want a deer villager, NOBODY else will do. PLOT TWIST!"
38,EquinoxOscuras,1593616239,hjc2ok,4,10,,AnimalCrossing,I'll never feel this kind of high again.
39,delvey89,1593615088,hjbp0l,5,10,,AnimalCrossing,Some rams just want to watch the world burn 🤡 artwork by me :)
40,Crow621621,1593614231,hjbf05,10,9,,AnimalCrossing,Finally Got A Blue Rose
41,81698,1593614400,hjbh0s,7,9,,AnimalCrossing,Does anyone else prefer the old design of the garden tank? I thought it was so much prettier
42,arretay,1593616547,hjc6c8,2,9,,AnimalCrossing,Happy Canada Day to my fellow Canucks!
43,Icairy,1593613570,hjb797,14,9,,AnimalCrossing,Should I take this villager in my campsite?
44,Guy-Man4444,1593618310,hjcr5x,1,8,,AnimalCrossing,Today was a good day to fish!
45,PinkBananaBlue,1593616823,hjc9jc,3,8,,AnimalCrossing,It's laundry day!
46,haileywatling,1593612456,hjauvf,3,8,,AnimalCrossing,Getting somewhere.....
47,angelathorne,1593616239,hjc2oy,6,8,,AnimalCrossing,I gave Marshal the winter solstice sweater and he looks so cute!!
48,animalcrossingbiskit,1593615449,hjbt5z,7,8,Today I finally got a five star rating for my island!!!,AnimalCrossing,5 stars
49,Krytonator,1593615615,hjbv3j,1,8,,AnimalCrossing,Snooty eagle photo get!
50,printhessa,1593616335,hjc3wk,19,8,,AnimalCrossing,"""A whole new world"" 🎵"
51,mandymcd1029,1593617364,hjcfzr,13,7,,AnimalCrossing,My brother just recovered from cancer and Celeste gave him this
52,atomicbunny,1593615804,hjbxfj,1,7,,AnimalCrossing,After a month ignoring ocean shadows with no fin...
53,Eestherrrrr,1593612137,hjardy,1,7,,AnimalCrossing,qwq
54,Revrush,1593614667,hjbk4d,0,7,,AnimalCrossing,Campground is coming along nicely!
55,toffee-apple-,1593614798,hjbllk,0,7,,AnimalCrossing,So thankful of this game because I’ve been dreaming of seeing Northern Lights on my graduation trip (cancelled by covid) but now I get to experience Southern Lights!!
56,ApologeticallyEmily,1593614691,hjbkeu,3,7,I opened the game to see it raining so I couldn’t see it,AnimalCrossing,I woke up at 4:30 this morning so I could see the sunrise that everyone was talking about.
57,DayzFalling,1593615518,hjbtxv,5,7,,AnimalCrossing,I just want to build a path!
58,pancaeks,1593618158,hjcpc8,0,7,,AnimalCrossing,TIL you can sit behind the fish tank!
59,Silverjd14,1593615024,hjbo8d,1,7,,AnimalCrossing,Fashion Runway I Made
60,Epiphemeral,1593615350,hjbs1w,0,7,,AnimalCrossing,Fivehead (゜▽゜;)
61,GalaxyGirl2257,1593612870,hjazfz,2,7,,AnimalCrossing,"OMG YES, JUDY!!!!!"
62,RetroRaconteur,1593613723,hjb8zt,15,7,,AnimalCrossing,Checklist for New July Bugs &amp; Fish!
63,SwixSwax,1593611700,hjamj1,4,7,,AnimalCrossing,"oh look, it's another cicada..."
64,nintendoman69,1593618278,hjcqrq,2,7,,AnimalCrossing,I caught this thicc boy.
65,manwhoseesboobs,1593616058,hjc0ej,6,7,,AnimalCrossing,I found where my apartment complex is storing their turnips! Think they’ll sell high?
66,ItsGuty,1593616173,hjc1uw,0,7,,AnimalCrossing,Happy Canada Day to my fellow Canadians!
67,kedcat,1593613538,hjb6w1,1,7,,AnimalCrossing,a beautiful sky
68,kristinaskland,1593611891,hjaomh,14,7,,AnimalCrossing,Sweet Dobie💛
69,Kilogren,1593613289,hjb441,3,6,,AnimalCrossing,"Yes, this is a jojo reference."
70,Tytythesciencegu,1593611690,hjamfm,2,6,,AnimalCrossing,I got the recipient for gold armor on beach before I got pitfalls.
71,Deadlykitten91,1593614830,hjblys,0,6,,AnimalCrossing,Stitches in his cavalier shirt is the cutest thing ever I just wish he was wearing the hat too 😍
72,old_man_jn,1593616635,hjc7cq,1,6,,AnimalCrossing,"Phrasing, Poppy."
73,Jessica95Okinawa,1593613592,hjb7i5,1,6,,AnimalCrossing,little space for the 3 villagers who are in this zone of the island
74,CrimsonGear15,1593616043,hjc07z,2,6,,AnimalCrossing,Marina’s “thank you” present
75,fafawilbur,1593616953,hjcb2o,0,6,,AnimalCrossing,gotta keep an eye out for selener
76,jennikaroliina,1593614448,hjbhja,0,6,,AnimalCrossing,When the restaurant has closed half an hour ago but the last customer ate too much and fell asleep
77,pampleberry,1593619045,hjczxr,29,6,,AnimalCrossing,👀
78,Icairy,1593613345,hjb4pd,7,6,,AnimalCrossing,"After 475 hours of playing ACNH, I learned that Celeste gives you star fragments if you have all the DIY recipes"
79,maxwellhallel,1593618851,hjcxkb,1,6,"A moment of silence for Northern-Hemisphere Blathers, who is about to have the worst day of his life.",AnimalCrossing,A moment of silence - July
80,HerrBonobo,1593619387,hjd441,38,6,,AnimalCrossing,Rate my cosplay
81,karagranholm,1593617350,hjcftm,2,5,,AnimalCrossing,My 3 Favorite Villagers!!!
82,MegaMeower537,1593615144,hjbpnp,4,5,,AnimalCrossing,"After many days and SO many weeds, I finally reached 3 stars!"
83,sorrier_sand_cat,1593611780,hjanei,2,5,,AnimalCrossing,For Realsies?!
84,tixferrari,1593618328,hjcrdj,2,5,,AnimalCrossing,Happy Canada Day everyone 😊🇨🇦
85,quequequequ,1593619097,hjd0im,1,5,,AnimalCrossing,"I’ve always liked to think my two favourite villagers, Sherb and Deli, were best friends. They finally hung out together today!"
86,alxvlnz,1593618122,hjcoxb,0,5,,AnimalCrossing,We on a date
87,Okayleb,1593616110,hjc121,1,5,,AnimalCrossing,Had an Aurora tonight.
88,gokuwasasupersaiyan,1593615914,hjbypr,8,5,"My friend has had the game for a few months. While I got the initial letter from mom with the tissue box, the letter from mom on Mother's Day with the quilted backpack, and the one today (July 1st) with mom's plushie, he only recieved the initial letter from mom with the tissue box and nothing else since. Is anyone else having this problem, or better yet, does anyone know why? I googled and found a couple other people experiencing the same problem but no answers anywhere. Any help or input would be greatly appreciated.",AnimalCrossing,Is anyone else not getting letters from mom?
89,jetmax25,1593617152,hjcdfj,15,5,,AnimalCrossing,New Fish And Bugs For July
90,RikaRini,1593617113,hjccym,4,5,,AnimalCrossing,I drew Skye and Hugh as humans :D
91,miko2495,1593615570,hjbuk4,7,5,,AnimalCrossing,Working on an outdoor café. Not sure if I should get a brick fence around it or leave it as is
92,88nymeria,1593618954,hjcyuy,1,5,,AnimalCrossing,First time in Adobe Illustrator
93,Pecita,1593614504,hjbi6y,2,5,,AnimalCrossing,I regret this now..
94,beloved32,1593611674,hjama2,2,4,,AnimalCrossing,It just be like that
95,Kitty4Snugglez,1593612641,hjawyi,14,4,Can I get it if I time travel? Does it still grow out of season?,AnimalCrossing,Boy oh boy do I sure wish I had bamboo.
96,Scarlett264350,1593617925,hjcmkh,0,4,,AnimalCrossing,My work in progress film set! (Featuring me as the worst superhero ever 🥴)
97,scottyd91,1593617407,hjcgif,5,4,,AnimalCrossing,FINALLY!!! I can get rid of her now.. and get pietro :D
98,miko2495,1593615647,hjbvhb,0,4,,AnimalCrossing,And here’s a photo of the café
99,alfreak,1593614912,hjbmvp,12,4,"Hey guys, I promised Skye to catch wharf roaches but it's been hours and I couldn't find any. Now I can't have any normal conversations with her. Is it going to be like this until/unless I found the roaches?",AnimalCrossing,Can I break my promises?
100,capncantaloupe,1593707677,hk0aoi,1,2,,AnimalCrossing,Big Howard fans on Vegeta
101,kisstinaxoxo,1593732149,hk7xpb,112,1,,AnimalCrossing,Welcome to “Club Penguin.” ❄️🐧
102,pokemonjk20,1593701697,hjyh45,5,1,"In your opinion, has this game become out of date or would you still play it in 2020?",AnimalCrossing,"In 2020, is Animal Crossing New Leaf obsolete?"
103,StaringBerry,1593710559,hk17f5,7,1,"I have a skinny but long section of land next to a river on the second level of my island that I don’t know what to do with. 

It’s up in my camping/rural area so I’d like to keep it “natural” feeling. I have a nature trail that leads to my campsite, a natural “pool” (pond), a playground, and this empty area. Right now I have the path and trees blocking the strip but it’s a big area that has a lot of potential. 

Any ideas?",AnimalCrossing,Ideas for thin/long section of island?
104,CaspieBadKid,1593720490,hk4d4b,4,1,,AnimalCrossing,"Kicked out Pecan, used 1NMT, GOT JUDY."
105,burrito_succ,1593699985,hjxz3k,5,1,I wanna know so I can get diving early lol,AnimalCrossing,What time does the update release?
106,lauraassy,1593717212,hk3b8w,17,1,,AnimalCrossing,Hands up if you can relate to Stitches 😂💞
107,whatsinthecupsir,1593721394,hk4n0m,23,1,,AnimalCrossing,When your friend saves your life
108,KaitoSan75,1593726687,hk6afn,7,1,,AnimalCrossing,Parent (bear) with their respective child (cub)
109,lauren210426,1593708844,hk0nu3,11,1,,AnimalCrossing,Little Molly and her flower parasol 🌼 she’s such a sweetie
110,Grimsvard,1593715636,hk2tjv,7,1,,AnimalCrossing,(CUE DEATH METAL MUSIC) YOU'RE A SH*TTY BOSS!!!!!!!!!!! I HATE YOU SO MUUUUUUUCHHHHH--
111,childishlambdino,1593722627,hk50nu,6,1,,AnimalCrossing,Just Maple looking unbelievably adorable in her giant ribbon
112,s1llym0nk3y,1593669665,hjrhok,6,1,,AnimalCrossing,Let me come to your island and take photos
113,fuzzyXbird,1593705690,hjzole,62,1,,AnimalCrossing,My girlfriend wanted to share her Pietro plushy :)
114,jcoop007,1593694595,hjwi9v,13,1,,AnimalCrossing,Crazy night of fishing!
115,Cerebralbore101,1593725380,hk5vt3,12,1,,AnimalCrossing,I invited Blathers Camping! Outside! Where... the... bugs... live! :D
116,MeanMustacheMan,1593702295,hjynix,32,1,,AnimalCrossing,"Have you tried looking to your right, Marina?"
117,momsparkblog,1593726795,hk6bn2,3,1,,AnimalCrossing,"I made a botanical space with custom simple panels, stalls, and a ton of plants (of course). Happy with how it turned out!"
118,astro-ponies,1593710367,hk153v,15,1,,AnimalCrossing,I finally have all my favorite villagers!
119,SplatoonPornAccount,1593727231,hk6ggx,63,1,,AnimalCrossing,Label will accept anything
120,insecuredane,1593688797,hjv75r,0,1,,AnimalCrossing,A few days ago I opened my island so people could sell turnips and today Julian is moving in from one of those islands! ✨
121,angelicuhh503,1593688401,hjv48t,0,1,,AnimalCrossing,parks and recreational area✨ I like to think of Marshal as Ron and he’s in charge of this area😂
122,Scarlett264350,1593687152,hjuvb9,0,1,,AnimalCrossing,My WIP space room 💫 Let me know if you have any suggestions ♥️
123,mxxi92,1593689579,hjvd2p,1,1,,AnimalCrossing,Panda’ Street Food Market is ready for business ✌🏼
124,rBaiIey,1593687742,hjuzfb,3,1,,AnimalCrossing,My new passport lol
125,chonk-chonk-chonk,1593687832,hjv03d,2,1,,AnimalCrossing,Marshal became Giorno???
126,KawaiiPikachu28,1593669165,hjre3b,16,1,My house inventory has been full for months my whole house is covered in random stuff and now I'm forced to drop random stuff on my island 😩 I hope this new update has something to do with house inventory cuz this is getting out of hand same with custom designs space,AnimalCrossing,Anyone else struggling when the house inventory space
127,nadiatown,1593692077,hjvwr5,4,1,,AnimalCrossing,My English garden 🌲☘️🌿🍃
128,carostrophy,1593690980,hjvnr7,4,1,,AnimalCrossing,So my mom has Merry leaving and Idk where to ask.. does anyone want to take this angel??
129,hooray_for_todd,1593690382,hjvj7z,3,1,,AnimalCrossing,I would like to introduce you to the mayor of my island. My island is called Beerport 🍻
130,Bauernhofreggae,1593692345,hjvyxo,0,1,,AnimalCrossing,Started to build a little island on my island😄
131,RainbowKnight__,1593691209,hjvpil,2,1,[removed],AnimalCrossing,Gold Tools For Sale
132,LilTeaPot77,1593692006,hjvw7b,0,1,,AnimalCrossing,Wade knows what’s up
133,pixelvirus89,1593688097,hjv226,4,1,,AnimalCrossing,I know it’s simple but I made a room for me and my daughter (15 months old) in hopes she’ll grow up to love the night sky like me
134,SwixSwax,1593691902,hjvvcu,0,1,,AnimalCrossing,"""It's over, Anakin! I have the high ground! ...ground!"""
135,sakuraislandAC,1593692235,hjvy24,0,1,,AnimalCrossing,My robot heroes with a little extra on the side 😄🐧
136,bingoboba,1593692497,hjw090,0,1,,AnimalCrossing,Upgraded my campsite!
137,akachipsahoy,1593688092,hjv20h,5,1,,AnimalCrossing,Here's a list of times the Summer Update comes out!
138,Ollie_n_Poppy,1593693808,hjwbfc,1,1,When you absolutely love your designs you have and then find more! The amount of talented people in this game is crazy!! It seems like we have to really commit to a few paths and a handful of signs and that’s it!,AnimalCrossing,What do you guys do when you’re only allowed the small amount of slots for designs?
139,Lifeesstwange,1593703763,hjz3il,0,1,,AnimalCrossing,I am a man child.
140,elenapng,1593703848,hjz4hw,0,1,,AnimalCrossing,The pufferfish puffs up and floats around when you change the light :)
141,Kat_AnimalCrossing,1593702318,hjynsg,2,1,[removed],AnimalCrossing,"I’m looking for a sphinx and a pyramid. I can offer NMT, bells, DIYs :)"
142,anzhelikaMD,1593668740,hjrayz,7,1,,AnimalCrossing,The crossover we didn’t know we needed
143,PegasusWrangler,1593688696,hjv6db,2,1,,AnimalCrossing,Deer love
144,shockerblocker,1593703215,hjyxgg,2,1,,AnimalCrossing,My new bunny villager isn’t too bad tbh
145,NSFWBOT20,1593705511,hjzmka,1,1,,AnimalCrossing,"accidentally put ken on the cliff without second thoughts, but now he looks like an old samurai chicken from a movie, now it looks kinda nice."
146,Texasgirl190,1593684041,hju9p8,5,1,,AnimalCrossing,When you really need to fill in that hole.
147,not_a_nice_guy_wow,1593702305,hjynn9,11,1,,AnimalCrossing,Bridges without water would be so cool!
148,molliej1997,1593705515,hjzmly,2,1,,AnimalCrossing,Does anyone have one of these brown surfboards I could have?
149,MemeLord004,1593706279,hjzv2f,0,1,[removed],AnimalCrossing,"I bought 100 fish bait and tracked the results, here is what happened."
150,minimuffinbasket,1593702867,hjytrj,2,1,,AnimalCrossing,either this or let me stack flowers
151,remobymahmood,1593700896,hjy8r0,5,1,,AnimalCrossing,yikes
152,lilsquash21,1593701293,hjyd10,2,1,,AnimalCrossing,Restarted my island and finished setting up the first 3 plots and Sherb just moves in! High key living for it 🥰 (even though I won’t get their interior)
153,Maomita,1593705148,hjzimg,2,1,,AnimalCrossing,"Thought this dress is really cute... The front nice, the back naughty"
154,Bowtruckle-Pickett,1593691296,hjvq95,1,1,,AnimalCrossing,"This made me laugh out loud lol, she's so cute"
155,su_acnh,1593694463,hjwh4g,0,1,,AnimalCrossing,a beautiful winter morning ✨
156,blondielockss,1593694576,hjwi3q,4,1,,AnimalCrossing,My villager photo gallery! The top are my 10 current villagers (missing 3) and the bottom are my 5 previous villagers that moved out!
157,SuNgAm7002,1593695158,hjwnib,0,1,,AnimalCrossing,Finally
158,begselwalch,1593696364,hjwyqg,0,1,"&amp;#x200B;

&amp;#x200B;

https://preview.redd.it/s6j0ba4m3g851.jpg?width=650&amp;format=pjpg&amp;auto=webp&amp;s=aba11684de445cb08848d90a3052b809f1444d7a

https://preview.redd.it/o8g0qq9o3g851.jpg?width=650&amp;format=pjpg&amp;auto=webp&amp;s=4529d1cb0e19597a107f925fe16089ce9242cc56",AnimalCrossing,Started playing the game like 2 weeks ago - here are two party photos with my besties
159,presto303089,1593698701,hjxlud,0,1,,AnimalCrossing,Look who just visited my island 🌴🐶
160,shaylor93,1593655195,hjo86u,8,1,,AnimalCrossing,Finally happy with my entrance (with only one waterfall!)
161,potatomaster368,1593698256,hjxhba,1,1,Or the materials. I need lots of them and don’t have enough materials. I’ll pay anyone who wants to give some,AnimalCrossing,Can anybody make me hedges ?
162,youroldcanofbeans,1593697415,hjx8yg,0,1,,AnimalCrossing,Oh Cookie... you sure that’s just a soda?
163,savrb1952,1593696525,hjx0ao,5,1,,AnimalCrossing,I didn’t get the sunglasses memo
164,michelleike,1593699056,hjxpk5,1,1,[removed],AnimalCrossing,Looking for the Perfect Birthday Gift!
165,Ben__Harlan,1593676989,hjsz1b,2,1,,AnimalCrossing,"Today i'll have great stalks prices on my island, so i had to make a pixelart of an AC turnip."
166,Lynke524,1593656736,hjolmq,12,1,,AnimalCrossing,Sometimes I Wish We Could Sing With Our Villagers!
167,magicalgirlflesh,1593692063,hjvwmr,6,1,,AnimalCrossing,my island is a MESS! how could i improve it whilst keeping the natural layout?
168,amyjandrews,1593689203,hjva53,3,1,,AnimalCrossing,"My island is a hot mess, how has this happened!?"
169,Maremama,1593695241,hjwobw,4,1,"Hello everyone, is there a way to force the spawn of the bugs only on the palm trees in the mystery islands? I'd like to get the new bugs, but I only find the old ones",AnimalCrossing,Force bugs spawn on palm trees
170,keolatte,1593693738,hjwau0,1,1,,AnimalCrossing,I think Bam was startled that I was trying to leave
171,InterstellarHit,1593660571,hjpif9,3,1,,AnimalCrossing,Marshal serenaded me earlier today while I worked on my island. It was nice but he was also completely in my way. He knew it too since he looked up at me like that lol.
172,gruuuuuumpy,1593697717,hjxbxw,0,1,,AnimalCrossing,CJ been buying the collectibles at Home Goods SMH
173,Beerusslunch,1593694396,hjwgje,4,1,,AnimalCrossing,my boy Henry vibing. Just a reminder of how wholesome this game is
174,Kat_AnimalCrossing,1593702412,hjyou3,2,1,[removed],AnimalCrossing,"Looking for a sphinx and a pyramid in exchange for NMT, bells or DIYs :)"
175,OtherwiseHornet9,1593703036,hjyvj4,0,1,,AnimalCrossing,Kept getting in my friends way while she was terraforming so she put him in time out 🤣
176,crescent-winter,1593703159,hjyww2,0,1,,AnimalCrossing,Can... can I join too?
177,TullipLovesSpring,1593703391,hjyzdi,0,1,,AnimalCrossing,They've done a bug price mug now!!
178,CaptFluffBallz,1593704536,hjzby5,0,1,,AnimalCrossing,Sassy much? Lol
179,expectfail,1593650164,hjmvwz,14,1,,AnimalCrossing,PSA: places grasshoppers have special cages
180,kiiwwiiw,1593700130,hjy0lq,1,1,I have a question! Can any body make the theme song to the nanny as a town tune to acnh so I can have it! I have tried but can't make it! Please help me Reddit!♥️,AnimalCrossing,Help
181,pigeonsask,1593658001,hjoweh,5,1,,AnimalCrossing,He’s ready to catch some new bugs in July!
182,Firefly_moon,1593699241,hjxrg4,3,1,So my original villager frita left today but I didn't get the chance to get her photo does anyone have her photo that they can give me?,AnimalCrossing,Fritas photo
183,SwannyBoi05,1593697216,hjx6xw,2,1,,AnimalCrossing,First try
184,Solaaris83,1593694996,hjwm17,3,1,"Other than species, is there a difference between Pietro and Marshal? I like them both but it seens Pietro just seems to say word for word the same as Marshal and vice-versa.  


I know they are both smug but it's kinda sad too..:(",AnimalCrossing,Pietro and Marshal
185,cuethesadmusic,1593661087,hjpmrc,5,1,,AnimalCrossing,I decided to paint my dog today and here’s how it turned out ❤️
186,presto303089,1593701034,hjya9p,0,1,,AnimalCrossing,Look who visited my island today
187,AllTime9Pointer,1593701660,hjygrb,0,1,[removed],AnimalCrossing,Interest in a Fossil Sale?
188,willthethrill346,1593701671,hjygvi,0,1,,AnimalCrossing,Selling this hat table for 1 million bells anyone wanna take it?
189,Lolyjr,1593705189,hjzj2k,7,1,,AnimalCrossing,Why aren’t my trees growing? I’ve left them growing for a while and we’re the first tree I planted?
190,ohrulosttoo,1593702859,hjyto2,10,1,,AnimalCrossing,I finally did it!!
191,JackDoesAThing,1593705352,hjzkvu,7,1,,AnimalCrossing,If Morgana from Persona 5 was in Animal Crossing
192,CometShard,1593710123,hk12ck,0,1,,AnimalCrossing,Moose gives me that big bro banter and I love him for it
193,CalamityPhant0m,1593697151,hjx6bi,6,1,"Hello I am a new Animal Crossing player and although I wish I’d played the other games to help with this journey, I’m having a blast nonetheless! MY CONFUSION/QUESTION(s) are concerning the portion of the game when you have JUST BUILT/LAID THE CAMPSITE. I went back to Tom after laying it down and did the ceremony and then after asking him again (post-ceremony) he said how he believes people will show up, spruce up the island, blah blah blah... So, WHEN do I get the option to “Purchase Plot(s)” that way I can look for a new villager ON MY OWN whilst there isn’t a camper there yet. I’m doing this in real time and have completed all the other things there are up to this point. 

I want to be able to hit a couple mystery islands and also my wife will have one or two available shortly I want.. 

CAN ANYONE GIVE ME A DEFINITIVE ANSWER??! The questions about timelines and time travel and consequently the stuff that may or may not happen because of it are VERY sketchy and widespread. Thanks in advance...

Stevie Ray in Blue Bayou",AnimalCrossing,HELP NEED CORRECT ANSWER?! (Plots/Houses)
194,meorilou,1593710238,hk13pb,0,1,,AnimalCrossing,"My girlfriend drew Jeremiah, my favorite villager, for my B-Day, its so cute so I wanted to share it with y'all (Jörg is his german name)"
195,juliefromeverdell,1593704353,hjz9zq,4,1,,AnimalCrossing,Here we go!
196,nae-nae-gang,1593710257,hk13xa,0,1,,AnimalCrossing,Sorry if this has already been posted but the pun changes in the rain
197,overlookglow,1593707324,hk06qa,1,1,,AnimalCrossing,RIP Reese &amp; Cyrus
198,t-abb-y,1593706849,hk01cr,4,1,,AnimalCrossing,"My husband doesn't like Coco, but how could he not? She is so cute! 💞"
