,author,created_utc,id,num_comments,score,selftext,subreddit,title
1657,NSFWBOT20,1594999108,hsxhun,1,1,"so it started when i want rhonda (snooty rhino) but i have too let go of cookie (peppy dog) and i wanted someone too save her from the void and someone asked too get her, they asked her too move in but they said in DMS that the empty spot was taken by cobb. i was devestated. i could not let cookie go to the void. but then he had to ruin it. i just couldnt. we tryed everything but cookie went into the void and i will never see her again with the same memories. 



(i know your true intentions behind those glasses, you cookie killer)",AnimalCrossing,"i dont HATE cobb, but heres the story of how cobb killed my 2nd favourite doggo cookie."
1658,Vixenon,1594986321,hsu8gq,0,1,,AnimalCrossing,"Made some art of my favorite villager, Kyle ^^"
1659,Chilli-byte-,1594986547,hsua48,1,1,,AnimalCrossing,After hours of wrangling with game mechanics (and glitches) I can finally present to you: Dragonfly Mountain Falls!
1660,Soodan1m,1594971728,hsrkjn,1,1,,AnimalCrossing,"Holy cow. I started another character to cheer up my villagers, and Phoebe is on to me!!!"
1661,xmenlim,1594972160,hsrn8v,5,1,,AnimalCrossing,Sylvana is underated AF
1662,chiropterari,1594968878,hsr18f,6,1,,AnimalCrossing,I’M IN LOVE! The aurora fits so perfectly with these new areas!!!
1663,bitchitschiefpeep,1594965096,hsqboe,8,1,,AnimalCrossing,Caught my first oarfish 😎
1664,Memodeth,1594972269,hsrnxa,0,1,,AnimalCrossing,BUBBLEGUM Remix
1665,Soodan1m,1594974246,hss0jh,0,1,,AnimalCrossing,"Tutu is my favourite villager. Insert is my iPad drawing of her. She wants to be a pop star, so I put her house on the beachfront with a karaoke stage. I just built this driveway tonight ..."
1666,dallasdina,1594977955,hssnmw,4,1,,AnimalCrossing,"where am i, and how can i leave?"
1667,aminaharyan,1594970493,hsrc4i,1,1,,AnimalCrossing,"Oh to be Bob, eating a popsicle and watching the meteor shower"
1668,Russianblu6,1594978209,hssp6d,0,1,,AnimalCrossing,Went back in time just to steal that b*tches moment.
1669,Bidoof_oof,1594969658,hsr6hi,2,1,,AnimalCrossing,So basically this is my basement where I do black market things :)
1670,lilaaaxx,1594964922,hsqafx,1,1,,AnimalCrossing,Hopkins what are you
1671,oyasoup,1594965645,hsqfck,2,1,,AnimalCrossing,Drew ACNH Broccolo! :3
1672,NSFWBOT20,1594971957,hsrlyx,1,1,,AnimalCrossing,"olaf moved out and i miss him, then i found out whos moving in next. i still cant find her in NH you gotta be kidding me"
1673,WinterKnight1,1594982072,hstej1,6,1,"Recently one of my villagers (Jacques) asked me to change his catchphrase, so I told him to start saying giggity, thing is now half of my other villagers are saying it too is that normal? They're all using his new catchphrase how? Maybe it's like a contagious thing idk, anyone else has this happen?",AnimalCrossing,Is this normal?
1674,ethanxy,1594975196,hss6kn,8,1,,AnimalCrossing,CLAUS WHERE THE HELL ARE YOU BRO
1675,Tat-lou,1594981391,hst9vg,0,1,[removed],AnimalCrossing,Still looking for a Cicada shell and a scarab
1676,Kakonic,1594984941,hstybc,10,1,I currently dont have a switch right now because they're impossible to find but I do have a 3ds. I was wondering if I should l wait until I can get a switch and buy new horizons or just buy new leaf right now. I've only played a little bit of the first animal crossing if that makes a difference. Please help me decide,AnimalCrossing,Should I wait and buy New Horizons or buy new leaf right now?
1677,venusfly-,1594973584,hsrwgt,1,1,,AnimalCrossing,made an astronomy area for Celeste behind my museum :)
1678,birchmark,1594974008,hsrz27,2,1,"Is there a way for me and a friend to go to the same Harv's island together?  

&amp;#x200B;

Thank you for your help",AnimalCrossing,Can you go to Harv's Island with other people?
1679,--mischiefmanaged,1594973558,hsrwb4,6,1,,AnimalCrossing,Finally got to turn Bamboo Island into Scorpion Island. I think I did pretty good!
1680,sour_jello456,1594967471,hsqrme,2,1,,AnimalCrossing,My first double rainbow! didn't know it was a thing!
1681,localwaternymph,1594976629,hssf6m,0,1,,AnimalCrossing,more friends = more flowers （*＾ワ＾*）
1682,raeann559,1594966906,hsqnxh,2,1,,AnimalCrossing,She's not a zebra
1683,Jassydfwu,1594973282,hsrui3,0,1,,AnimalCrossing,Nothing to see here
1684,bokoroki,1594968754,hsr0e1,0,1,,AnimalCrossing,I thought this looked pretty
1685,natnatenath,1595009351,ht0o9a,0,1,,AnimalCrossing,TFW you miss your flight going home
1686,cammnt,1595009106,ht0lfj,0,1,[removed],AnimalCrossing,Omg what if they had like customizable construction kits
1687,withshootingstars,1595008011,ht09ca,2,1,[removed],AnimalCrossing,Anyone want Merengue?
1688,YupaDoto,1595011016,ht16r3,0,1,,AnimalCrossing,Mitzi is having none of that complicated Stove business
1689,microwavedplum,1595009701,ht0s8h,1,1, [https://www.youtube.com/watch?v=lrItcEGbSj0](https://www.youtube.com/watch?v=lrItcEGbSj0),AnimalCrossing,The animal crossing: new horizons experience perfectly summed up by this clip
1690,aelynnnnnnnnm,1595011906,ht1gl3,0,1,,AnimalCrossing,"upgrades people, upgrades!"
1691,ImNiceGuySmile,1595009547,ht0qij,2,1,"  I have slopes on both sides of the walkthrough park. It is sort of in the shape of an L. I have villagers that live on the second level some directly near the slope, but none adventure to the third level. I spent a lot of time on the paek. Benches, flowers, trees, ans decor, everything under the sun. Yet, it is never touched. How do I fix this?",AnimalCrossing,"Help! I have made a sweet walkthrough park on a third level section of my island, but the villagers never go up to the third level. Why and how do I fix this?"
1692,BoycottMathClass,1595014502,ht299m,0,1,,AnimalCrossing,Me when my villagers won’t sit on the chairs I lay out for them but sit on random chairs I set out for two seconds while I’m re-arranging
1693,Aloiciousss,1595009761,ht0sw4,3,1,,AnimalCrossing,The Cult of St. Nook
1694,no1curr,1595014466,ht28w9,0,1,,AnimalCrossing,Wade looks good with instant muscles
1695,karagranholm,1595006079,hsznq1,3,1,,AnimalCrossing,Can anyone tell me why those middle saplings aren’t growing?
1696,sixelabalexis,1594954487,hsnyt1,4,1,,AnimalCrossing,Summery bathroom vibes. Wish we had more blue furniture tbh
1697,Who_StoleMyKellogs,1595005234,hszdot,3,1,,AnimalCrossing,aw my villagers came by the park i see
1698,kwispeebakin307,1595005517,hszgzi,8,1,,AnimalCrossing,What type of table/chair set should I use for this boba shop outside seating?
1699,EleanoraMarch,1595007550,ht047h,0,1,If you want to come over DM me. A little tip would be really nice,AnimalCrossing,Celeste is on my island!
1700,Spidey0062,1595092370,htk602,1538,47568,,AnimalCrossing,Accurate
1701,one11oh,1595091850,htk0ql,261,13886,,AnimalCrossing,Has this been done before
1702,ColeFrmStateFarm,1595110022,htp6lr,78,8190,,AnimalCrossing,Thank you @h0neyPudding for making an amazing piece of me and my wife to commemorate our 2 year wedding anniversary.
1703,VolcanWulf24,1595089742,htjfaa,222,7726,,AnimalCrossing,Jeremiah does this all the time and it's the cutest thing 🥺❤️
1704,denverite16,1595111710,htpnfc,140,7528,,AnimalCrossing,💯💯
1705,roxytron,1595095018,htkxc7,124,5291,,AnimalCrossing,Tropical Vibrance 🌺🌴
1706,tofuking,1595106934,htocpk,128,5147,,AnimalCrossing,I spent a month building a platforming obstacle maze race!
1707,itspink1996,1595101473,htmsqr,90,4481,,AnimalCrossing,You still can't sit with us!
1708,SwixSwax,1595096593,htldni,37,4133,,AnimalCrossing,"The preferred term is ""inspo"""
1709,NinkonLoL,1595099125,htm3ke,25,2280,,AnimalCrossing,What my Parents think
1710,weepul355,1595105138,htnuix,58,2096,,AnimalCrossing,Made myself a neat animal crossing chain 🥰
1711,TriniTDM,1595113577,htq55l,70,1827,,AnimalCrossing,YES
1712,emily_what98,1595096305,htlarj,84,1537,,AnimalCrossing,So I made a small dispensary on my island.
1713,SwixSwax,1595097761,htlpo5,97,1460,,AnimalCrossing,Net Loss
1714,dakneees,1595112495,htpux8,30,1198,,AnimalCrossing,My entrance! Hope you guys like it (restarting my game though for a different map!)
1715,eowyn1990,1595115723,htqooz,49,910,,AnimalCrossing,"Personalised gardens for my villagers! 🌸🌈🍒 (Sherb and Lily have now left, but I loved their colour schemes so much that I had to include them)"
1716,Random-ACNH-Islander,1595101052,htmo82,84,895,,AnimalCrossing,I moved out Ruby bc she was one of my first 5 and always felt bad since she and Raymond always hung out. I found her a few days ago and moved her back to get her real house and I caught them having a reunion today🥺 I'm literally going to cry
1717,FriedOreo,1595097376,htllnj,10,822,,AnimalCrossing,My grand entrance!
1718,BeckyBoo122,1595114423,htqd32,40,752,,AnimalCrossing,My husband and I dressed our characters up as Alexander Hamilton and King George III
1719,tylerfauley,1595099810,htmb48,24,738,,AnimalCrossing,Impossible
1720,jedi-bat-ninja,1595089116,htj8vr,69,723,,AnimalCrossing,"In the darkest times, hope is something you give yourself. That is the meaning of inner strength.” - Uncle Iroh"
1721,Malloy95,1595089733,htjf75,28,667,,AnimalCrossing,I don't think I've ever been prouder of a room than I am my attic bedroom.
1722,harley-quinn-94,1595113213,htq1od,40,629,,AnimalCrossing,"It saddens me that there’s no long sleeve dress option that isn’t a ball gown, so I’ve been using the coats a lot to design instead! Putting a skirt (or shorts!) underneath gives it a nice trim too. Here’s two of my faves so far 😊"
1723,Powertato,1595089295,htjaqx,18,595,,AnimalCrossing,Beau in his sprite costume &gt;
1724,WagnerIsLit,1595103677,htnfo4,33,580,,AnimalCrossing,"I think a psychoanalyst would have a lot to say about that, Flurry"
1725,chipolthey,1595096459,htlcac,53,575,,AnimalCrossing,Nook’s Cranny as an abandoned gas station
1726,Thousand_Sunny,1595098947,htm1qs,8,571,,AnimalCrossing,WHO?!
1727,lealcass,1595111195,htpi84,10,509,,AnimalCrossing,Her name is JOAN and she is WONDERFUL. Via kyary of tumblr
1728,omgpeachsnapple,1595101008,htmnqj,53,507,,AnimalCrossing,"Last month I lost a childhood friend and had a miscarriage. They’re both beside my grandmother and I’m glad to have a place to visit them, even if it’s virtual."
1729,Octaviar,1595111312,htpjga,24,462,,AnimalCrossing,And no more than 5 in the Cranny at a time!
1730,tuckman222,1595096509,htlcti,32,455,,AnimalCrossing,"everywhere i go, i see him. come back to us boy ;("
1731,sylveuns_,1595113357,htq33t,36,439,,AnimalCrossing,Was cleaning out a field a flowers when Rosie came up to me and said something ominous.....
1732,PinkBananaBlue,1595106215,hto5ga,19,437,,AnimalCrossing,An idea for a bathroom
1733,UnsavorySatan,1595101806,htmw7n,26,407,,AnimalCrossing,Finally finished my bathroom!
1734,SwixSwax,1595100254,htmfpn,28,366,,AnimalCrossing,Tom Nook for a day
1735,AlGtheProtist,1595110632,htpcoz,8,348,,AnimalCrossing,A C+ meme
1736,user001414,1595115907,htqqca,13,330,,AnimalCrossing,the 3 stages of decorating:
1737,CccYou,1595110861,htpevx,34,304,,AnimalCrossing,"I'm working on a line of gay clothing for my gay island, here's the first installment for you!"
1738,CozmicBean,1595099005,htm2ct,32,294,,AnimalCrossing,Finally got three stars on my island! K.K.’s first concert made me cry tbh
1739,Anedira,1595099495,htm7t8,22,285,,AnimalCrossing,"My ""floating"" rock garden~"
1740,bowlerboy2,1595099492,htm7rv,32,284,,AnimalCrossing,Roald just got a job a Walmart!
1741,greenmemesnham,1595101275,htmqm8,47,277,,AnimalCrossing,"I’m currently trying to gain weight and it’s kind of been hard for me to make meals, plan ahead, and just eat in general. Interactions like these make me love AC even more"
1742,nerdette93,1595108024,hton7x,14,274,,AnimalCrossing,"Thank you to everyone that came to my son's island for his birthday and gave him gifts. Everyone was exceptionally kind. He really enjoyed seeing everyone and you all really made his day. We couldn't do a huge party like usual because of COVID, so this was really special. THANK YOU"
1743,[deleted],1595102152,htmztg,14,244,[deleted],AnimalCrossing,Me and my villagers
1744,Giallah,1595115447,htqm9w,16,211,,AnimalCrossing,[OC] I drew my AC’s character in my style ~
1745,Bebeness,1595116291,htqtpv,24,204,,AnimalCrossing,I drew Celeste for my redditgifts Secret Santa!
1746,freshmammoth,1595102678,htn5cf,12,183,,AnimalCrossing,Our villagers’ personalized yards
1747,guykopsombut,1595092742,htk9qo,28,182,,AnimalCrossing,Chitinous kindred. [OC]
1748,JocyFlo,1595090782,htjq05,32,174,,AnimalCrossing,My son named himself My butt. I crack up every time. 😂
1749,toyfantv,1595090102,htjiy4,19,174,,AnimalCrossing,Made a diving spot
1750,ellesbanhmi,1595091870,htk0yt,17,165,,AnimalCrossing,The Headmaster’s Office at Hogwarts! ✨
1751,comeawaymelinda,1595106930,htoco7,27,155,,AnimalCrossing,I ranked the special characters in New Horizons according to how decently clothed they are.
1752,m4llycat,1595097354,htllft,8,150,,AnimalCrossing,I'm pretty happy with how my museum entrance turned out!
1753,Bubbly_Willow2,1595113956,htq8rs,9,146,,AnimalCrossing,Proud of my Able Sisters yard! Has its very own workshop.
1754,m4llycat,1595089898,htjgvq,14,131,,AnimalCrossing,Made a little desert market!
1755,Bunny613,1595112100,htpr2o,9,130,,AnimalCrossing,"I had to put my dog to sleep after 12 years, I made a headstone for her so no matter where I am I can always visit her."
1756,annies_b00bz23,1595099827,htmbac,43,129,,AnimalCrossing,An island with a fire but no visitor.
1757,Shambles299,1595091591,htjy2y,6,128,,AnimalCrossing,I'm completely self isolating for an upcoming surgery and can't see my girlfriend. She was visiting my island and I surprised her with some flower art. I love having Animal Crossing dates.
1758,-babito-,1595098692,htlz4h,16,118,,AnimalCrossing,fake store front behind resident services
1759,xXNightshade96Xx,1595115626,htqnta,16,117,,AnimalCrossing,It's called fashion. Look it up. lol
1760,SwixSwax,1595097381,htllp9,10,113,,AnimalCrossing,"I'm not mad, I'm just disappointed"
1761,batphoned,1595112962,htpza9,15,101,,AnimalCrossing,not as good as most builds on here but i’m really proud of chrissy’s little farm area🌷
1762,eponinesflowers,1595113514,htq4l5,16,99,,AnimalCrossing,Butch wearing my lesbian shirt design is something I never knew I needed💕
1763,asdfghjumiii,1595107757,htokk9,20,98,,AnimalCrossing,"Anyone here who’s a fan of the Japanese actor Miura Haruma? His death saddens me and I still can’t believe that it’s real. I made a little space dedicated for him for me to mourn. Rest in peace, Haruma. :("
1764,admittedlynerdy,1595112515,htpv3t,4,98,,AnimalCrossing,You. Are. A. TOY!
1765,eithernight,1595105586,htnyzc,4,92,,AnimalCrossing,Found this paperweight shaped like a star fragment at the thrift store today!
1766,Naqu56,1595105093,htnu36,10,89,,AnimalCrossing,I’m Eric Ketchum from palet town
1767,karlibear,1595097793,htlq02,10,88,,AnimalCrossing,"I visited a Disney themed island today, and it was the most beautiful thing I’ve ever seen."
1768,SirCharlesOfKanto,1595108086,htonts,16,87,,AnimalCrossing,Finally finished my flower garden! Not the most traditional layout but i'm happy with how it turned out!
1769,printhessa,1595092626,htk8l0,18,85,,AnimalCrossing,Hunchback of Notre Dame
1770,ykit_mp4,1595103951,htnigp,4,84,,AnimalCrossing,It's at least a C-
1771,ImaginaryMairi,1595103226,htnb0z,18,83,,AnimalCrossing,I was today years old when I discovered you could do this...
1772,nae-nae-gang,1595091147,htjtnq,4,81,,AnimalCrossing,"While right outside the airport....very subtle, Pietro"
1773,patriotgrl,1595103773,htngmp,13,80,,AnimalCrossing,Me with my scallywags 🏴‍☠️
1774,BrittBoo18,1595096527,htlczy,8,80,,AnimalCrossing,Greetings from Underland! Joined reddit to see animal crossing inspo and memes. I’m doing a lot around my island and wanted to start showing it off!
1775,ummameme,1595100163,htmesb,16,78,,AnimalCrossing,"Not the cleanest work, but I finished my polymer clay sculpture of Stitches! ❤️"
1776,Prettyquail,1595101670,htmusd,6,78,,AnimalCrossing,Other people's villagers: let me cure your depression with how nice and thoughtful I am! My villagers after talking to them once:
1777,billienala,1595093936,htkm7b,0,75,,AnimalCrossing,quite happy with the way my bamboo area turned out 🥳🎋
1778,Naqu56,1595106651,hto9w6,16,74,,AnimalCrossing,Hmmmm...
1779,phoebeloverr,1595097512,htln1p,18,73,,AnimalCrossing,Huge Celeste Fan!
1780,Caperous,1595089031,htj826,6,72,,AnimalCrossing,Who needs Daisy Mae?
1781,catmountainking,1595092674,htk92m,24,71,,AnimalCrossing,[OC] *magical girl transformation sequence*
1782,junby1812,1595088993,htj7pk,10,66,,AnimalCrossing,My rainbow garden and Stitches' playground 🌈
1783,leylaluna,1595095688,htl4gp,12,62,,AnimalCrossing,Not a perfect photo but here’s my recently completed mush-themed campsite
1784,lyn_wolff,1595107995,htomya,0,62,,AnimalCrossing,Pascal knows!
1785,ashleeping,1595103876,htnhoe,4,60,,AnimalCrossing,he sat on hyacinths
1786,ihavenoideasry,1595090867,htjqwo,2,60,,AnimalCrossing,lemme sit here..ah no it’s probably more comfortable right next to the tree.
1787,purly3,1595111079,htph12,2,60,,AnimalCrossing,When you are trying to get KK Slider to play the song you like but you can’t remember the name
1788,Heartdrifts,1595100421,htmhgq,14,60,,AnimalCrossing,I made this spot for my grandma. She passed away last christmas after a long battle with alzheimers. I miss her every day &lt;3
1789,manifes7o,1595097984,htlrzm,4,56,,AnimalCrossing,Finally got a Moai Statue and made my own Easter Island
1790,CARAVANradio,1595099677,htm9ru,8,55,,AnimalCrossing,The Library is OPEN!
1791,buwaffle,1595091104,htjta8,16,54,,AnimalCrossing,Crocheted Celeste!
1792,Fentue,1595088870,htj6g2,12,51,,AnimalCrossing,[OC] So I Turned Some Animal Crossing Villagers Into Actual Animals
1793,SevPOOTS,1595106829,htobof,6,48,,AnimalCrossing,How productive I am
1794,s0lusek,1595097062,htlig8,4,48,,AnimalCrossing,daytime shot of my Statue of Liberty Area
1795,fantastic505,1595090347,htjli9,8,47,,AnimalCrossing,"Took me from 11pm to 3am, FINALLY caught it after 3 failed attempts..."
1796,aredua,1595112027,htpqeu,8,46,,AnimalCrossing,Built this cliff just so I could get a better view of my island :)
1797,[deleted],1595111620,htpmjn,2,43,[deleted],AnimalCrossing,lets eat 🍙🥢
1798,FiveTail,1595098047,htlsml,0,43,,AnimalCrossing,Dotty got a bit too relatable today...
1799,strawbhaby,1595100299,htmg57,8,42,,AnimalCrossing,I can't tell whether if this is an insult or a compliment.
1800,smooniie,1595196886,hu9chg,1412,35906,,AnimalCrossing,"Im just constantly tearing down and re doing parts of my island, still having fun though!"
1801,imma_doggo_,1595120926,htry0g,367,30212,,AnimalCrossing,Sleep? What’s that?
1802,InternetKillTV,1595166379,hu0qb4,565,29007,,AnimalCrossing,We did it buddy!
1803,-Mischka-,1595158446,htz2uj,404,22450,,AnimalCrossing,i recreated Arrietty’s bedroom!
1804,yad29,1595173448,hu2j7i,326,17626,,AnimalCrossing,New intro
1805,pampleberry,1595165554,hu0jge,377,15959,,AnimalCrossing,"Rain pls, stahp"
1806,arebaderci,1595160950,htzkui,330,14819,,AnimalCrossing,my most intense moment ever in gaming was trying to get this shot before they walked away while trying to combat joycondrift.
1807,TigerDoodle,1595129231,httvei,283,14583,,AnimalCrossing,Painting myself some ac shoes and I'm super happy with them so far
1808,sremmalmik,1595183962,hu5jkb,285,12983,,AnimalCrossing,I finally got around to decorating my own house! I think it’s turning out pretty nice 🍄
1809,chloromelanite,1595117809,htr76z,141,12413,,AnimalCrossing,a ballerina by the ocean ♡
1810,ninasubpoenabrown,1595200648,huacst,88,11508,,AnimalCrossing,I spent far too long making the text for this silly meme
1811,winterpupp,1595124556,htssck,175,11093,,AnimalCrossing,"Invited my mom, dad, sister, and fiancé over to wish on stars tonight! The entrance fee was wearing the star hats and princess dresses I put together for them. This is hands down the greatest photo I’ve taken in game so far!"
1812,annies_b00bz23,1595186135,hu67tm,175,9627,,AnimalCrossing,I made a little heart pond for Roald and Aurora behind their houses. I’m happy to see they’re making the most of it.
1813,gohan0098,1595131018,htu9j9,142,9268,,AnimalCrossing,"I LOVE Celeste, so I spent half of the day learning Wallpaper Engine"
1814,RonnieShmonnie,1595185173,hu5x2o,221,7198,,AnimalCrossing,"I love when the title screen lets me know which NPC is here today, since Isabelle won’t 😂"
1815,SteeloKriPlayAC,1595117970,htr8hv,247,6197,,AnimalCrossing,Eeek!!
1816,Vixichick,1595179323,hu45ec,109,5433,,AnimalCrossing,My boyfriend's 16 year old sister made me my own Daisy Mae for my birthday! ❤️😍
1817,AbjectTadpole,1595186175,hu689e,133,4837,,AnimalCrossing,I just realized Stitches has toe beans and not to be dramatic but I would die for him
1818,interrobang__,1595169443,hu1hhd,86,4125,,AnimalCrossing,When you and your BFF coordinate outfits 😻
1819,WinterKnight1,1595167403,hu0z3a,323,3755,,AnimalCrossing,I finally beat animal crossing 🥰
1820,mansonfamily,1595200640,huacqa,134,3042,,AnimalCrossing,"I wanted to see if I could make a room with every piece of the antique set, I’d love to know what you think"
1821,tinythanos,1595148452,htxfn0,82,2808,,AnimalCrossing,I just noticed the music chalkboard has the melody for the main theme on it!!
1822,jedi-bat-ninja,1595184400,hu5oh2,146,2801,,AnimalCrossing,Sick of tea?!?! That's like being sick of BREATHING!!!
1823,hellorainydayz,1595130081,htu2av,74,2492,,AnimalCrossing,"My small wedding is in a week, so here's a pic I took at just the right moment in a lightning storm wearing my wedding dress I designed in-game!"
1824,broniesnstuff,1595188274,hu6u58,80,2454,,AnimalCrossing,Dropped by the dispensary today
1825,HotHotPotato79,1595179184,hu43yi,56,2385,,AnimalCrossing,"Man I feel bad about them, they made plans"
1826,wanderingconspirator,1595167649,hu11b8,45,2285,,AnimalCrossing,My PacMan walkway
1827,gupitaro,1595195744,hu90ml,74,2266,,AnimalCrossing,"Coco’s reading &amp; sewing nook, tucked between the river &amp; trees. 🌿"
1828,MimsyIsGianna,1595141033,htw6s3,110,2174,,AnimalCrossing,Thoroughly and genuinely concerned and scared...
1829,muiyanyan,1595127332,httfkf,41,2061,,AnimalCrossing,"When I wear the fox mask and go fish, it looks like I'm taking a giant chunk out of each catch"
1830,drengibami,1595135133,htv443,26,2051,,AnimalCrossing,Detective Sokka on the case!
1831,lennylou100,1595169835,hu1kzc,107,2015,,AnimalCrossing,I made my basement into a pottery studio. I really love pottery and I haven’t been able to go to the studio for a while. I hope you guys like it! I’ll post another video but with the lights on ☺️
1832,bloxy_y,1595197946,hu9my5,94,1811,,AnimalCrossing,Just wanted to share the evolution of my island's residential area! ❤️🍄
1833,Objectivecause,1595166029,hu0nby,166,1625,,AnimalCrossing,I need help. I want to offer someone 1 million bells if they can help me find the diamond ring. I’m trying to propose to my girlfriend on animal crossing and I cant find it. Please help?
1834,sororitydork,1595163850,hu064d,48,1624,,AnimalCrossing,Started from the bottom now we here: Day 1 to Day 91
1835,tjaliz,1595195841,hu91m7,63,1531,,AnimalCrossing,new entrance 🌸
1836,anybodywantmorefood,1595142089,htwdc9,442,1523,,AnimalCrossing,ACNH Villager Tier List
1837,geeenius1,1595199932,hua61v,66,1429,,AnimalCrossing,I made a cake for my son’s birthday today.
1838,pinklimonade07,1595187829,hu6plj,45,1403,,AnimalCrossing,My bathroom
1839,Goatoat23,1595176372,hu3c2f,34,1382,,AnimalCrossing,Every damn time
1840,aplaxen,1595130970,htu94y,78,1330,,AnimalCrossing,Apollo: Rock God! Never thought he'd actually play his custom drumset and it's in sync with the music! 😍🦅🔥
1841,A_Buff_Squirrel,1595171401,hu1zcm,37,1162,,AnimalCrossing,"When you're on a deserted island, but not one from Nooks."
1842,Sweeney_Odd,1595186672,hu6dj8,35,1135,,AnimalCrossing,When you shop @ Able’s in real life
1843,-Shu,1595197335,hu9gx3,9,1124,,AnimalCrossing,Spotted Ankha standing behind the Cat Silhouette late at night. She had some pretty unique dialogue
1844,Alyceinreality,1595175508,hu33ge,54,1074,,AnimalCrossing,Just enjoying a lil pool time
1845,radditersaysihategd,1595128087,httlob,115,1063,,AnimalCrossing,I DID IT I GOT THE BLUE ROSE!
1846,theshorterstory,1595116989,htr01a,88,1051,,AnimalCrossing,"Last week this time I was buying turnips the night before I was being induced, now my littlest ACNH buddy is here and Tom Nook is reaping all of the benefits of my turnip excursion last week 😂🤑 #bitchbetterhavemybells"
1847,mcaing,1595171414,hu1zhl,79,1034,,AnimalCrossing,I finished my mermaid room! (Apparently I was so excited I took the picture without putting on any clothes! )
1848,cold_war0,1595173684,hu2lhn,60,977,,AnimalCrossing,scorpion.exe
1849,ailoveru,1595156188,htyo9i,40,977,,AnimalCrossing,I designed a castle area and it got featured in a Polygon article!
1850,emilyx38,1595194517,hu8nzo,35,944,,AnimalCrossing,My horse stables
1851,monika1927,1595202630,huavl6,30,941,,AnimalCrossing,Just enjoying my pool on a hot summer day!
1852,marliece,1595188805,hu6zqf,99,912,,AnimalCrossing,TWO in ONE DAY?! wtf is happening???? 😭💗
1853,sodapressing_,1595188236,hu6tr7,8,866,,AnimalCrossing,Creature Intersection
1854,Icairy,1595191214,hu7p6r,14,865,,AnimalCrossing,"Poor sock, it just wanted an adventure"
1855,Objectivecause,1595185446,hu6045,69,811,,AnimalCrossing,We got engaged IRL today on Animal Crossing. SHE SAID YES!!
